negative;I hear the train a comin' It's rolling round the bend And I ain't seen the sunshine since I don't know when, I'm stuck in Folsom prison, and time keeps draggin' on But that train keeps a rollin' on down to San Antone..  When I was just a baby my mama told me "Son, Always be a good boy, don't ever play with guns." But I shot a man in Reno just to watch him die When I hear that whistle blowin', I hang my head and cry..  I bet there's rich folks eating in a fancy dining car They're probably drinkin' coffee and smoking big cigars. Well I know I had it coming, I know I can't be free But those people keep a movin' And that's what tortures me...  Well if they freed me from this prison, If that railroad train was mine I bet I'd move it on a little farther down the line Far from Folsom prison, that's where I want to stay And I'd let that lonesome whistle blow my blues away...;Johnny Cash;Folsom Prison Blues
negative;Too many slaves in this world Die by torture and pain Too many people do not see They're killing themselves, going insane  Too many people do not know Bondage is over the human race They believe slaves always lose And this fear keeps them down  Watch the damned (God bless ya) They're gonna break their chains (hey) No, you can't stop them (God bless ya) They're coming to get you And then you'll get your  Balls to the wall, man Balls to the wall You'll get your balls to the wall, man Balls to the wall, balls to the wall  You may screw their brains You may sacrifice them, too You may mortify their flesh You may rape them all  One day the tortured stand up And revolt against the evil They make you drink your blood And tear yourself to pieces  You better watch the damned (God bless ya) They're gonna break their chains (hey) No, you can't stop them (God bless ya) They're coming to get you And then you'll get your  Balls to the wall, man Balls to the wall You'll get your balls to the wall, man Balls to the wall, balls to the wall  Come on man, let's stand up all over the world Let's plug a bomb in everyone's ass If they don't keep us alive, we're gonna fight for the rights  Build a wall with the bodies of the dead, and you're saved Make the world scared, come on, show me the sign of victory Sign of victory, sign of victory  You better watch the damned (God bless ya) They're gonna break their chains (hey) No, you can't stop them (God bless ya) They're coming to get you And then you'll get your  Balls to the wall, man Balls to the wall You'll get your balls to the wall, man Balls to the wall You'll get your balls to the wall, man Balls to the wall You'll get your balls to the wall, man Balls to the wall You'll get your balls to the wall, man;Accept;Balls to the Wall
negative;William Zanzinger killed poor Hattie Carroll With a cane that he twirled around his diamond ring finger At a Baltimore hotel society gatherin' And the cops were called in and his weapon took from him  As they rode him in custody down to the station And booked William Zanzinger for first-degree murder Oh, you who philosophize disgrace, and criticize all fears Take the rag away from your face, now ain't the time for your tears  William Zanzinger, who at twenty-four years owns a tobacco farm of six hundred acres With rich, wealthy parents who provide and protect him And high office relations in the politics of Maryland Reacted to his deed with a shrug of his shoulders  And swear words and sneering, and his tongue, it was a-snarling And in a manner of minutes, on bail was out walking But you who philosophize disgrace, and criticize all fears Take the rag away from your face, now ain't the time for your tears  Hattie Carroll was a maid in the kitchen She was fifty-one years old and gave birth to ten children Who carried the dishes and took out the garbage And never sat once at the head of the table  And didn't even talk to the people at the table Who just cleaned up all the food from the table And emptied the ashtrays on a whole other level Got killed by a blow, lay slain by a cane  Doomed and determined to destroy all the gentle And she never did nothing to William Zanzinger And you who philosophize disgrace, and criticize all fears Take the rag away from your face, now ain't the time for your tears  In the courtroom of honor, the judge pounded his gavel To show that all's equal and that the courts are on the level And that the strings in the books ain't pulled and persuaded And that even the nobles get properly handled  Once that the cops have chased after and caught 'em And that the ladder of law has no top and no bottom Stared at the person who killed for no reason Who just happened to be feelin' that way without warnin'  And he spoke through his cloak, most deep and distinguished And handed out strongly, for penalty and repentance, William Zanzinger with a six-months entence Oh, you who philosophize disgrace, and criticize all fears Bury the rag deep in your face, now's the time for your tears;Bob Dylan;The Lonesome Death of Hattie Carroll
negative;Well, we can't take it this week And her friends don't want another speech Hoping for a better day  To hear what she's got to say  All about that personality crisis, you got it while it was hot But now, frustration and heartache is what you got (That's why they talk about personality)  But now, your tryin' to be some, no, you got to do some Wanna be someone who cow wow wows But you think about the times you did, they took every ounce When it sure got to be a shame when you start to scream and shout You got to contradict all those times you were butterflyin' about (You were butterflyin')  All about that personality crisis you got it while it was hot But now frustration and heartache is what you got  And you're a prima ballerina on a spring afternoon Change on into the wolfman howlin', at the moon, hooowww  All about that personality crisis, you got it while it was hot But now, frustration and heartache is what you got  Now, with all the crossin' fingers that mother nature says Your mirrors get jammed up with all your friends That personality, everything starts to bend Personality, when your mind starts to bend Personality, impression of a friend of a friend of a friend of a friend of a friend Personality, wonderin' how celebrities ever mend (Look and find out on television)  Personality crisis, you got it while it was hot Frustration and heartache is all you got Don't you worry  Personality crisis, please don't cry It's just a personality crisis, please, don't stop  Because you walk a personality Talk a personality;New York Dolls;Personality Crisis
negative;I am the entertainer and I know just where I stand Another serenader and another long-haired band Today I am your champion, I may have won your hearts But I know the game, you'll forget my name And I won't be here in another year If I don't stay on the charts, oh  I am the entertainer and I've had to pay my price The things I did not know at first, I learned by doing twice But still they come to haunt me, still they want their say So I've learned to dance with a hand in my pants I let 'em rub my neck and I write 'em a check And they go their merry way  I am the entertainer, been all around the world I've played all kinds of palaces and laid all kinds of girls I can't remember faces, I don't remember names Oh, but what the hell, you know it's just as well 'Cause after a while and a thousand miles It all becomes the same  I am the entertainer, I bring to you my songs I'd like to spend a day or two, but I can't stay that long I got to meet expenses, I got to stay in line Got to get those fees to the agencies And I'd love to stay but there's bills to pay So I just don't have the time  I am the entertainer, I've come to do my show You've heard my latest record spin on the radio Oh, it took me years to write it, they were the best years of my life It was a beautiful song, but it ran too long If you're gonna have a hit you gotta make it fit So they cut it down to 3:05  I am the entertainer, the idol of my age I make all kinds of money when I go on the stage Ah, you see me in the papers, I've been in the magazines But if I go cold, I won't get sold I get put in the back in a discount rack Like another can of beans  I am the entertainer and I know just where I stand Another serenader and another long-haired band Today I am your champion, I may have won your hearts But I know the game, you'll forget my name I won't be here in another year  If I don't stay on the charts;Billy Joel;The Entertainer
aggressive;C'mon man  And with the local DDC news, LL Cool J with a triumphant comeback But tonight  Don't call it a comeback I been here for years I'm Rockin' my peers Puttin' suckers in fear Makin' the tears rain down like a monsoon Listen to the bass go boom Explosions, overpowerin' Over the competition, I'm towerin' Records shock When I drop  These lyrics That'll make you call the cops Don't you dare stare  You betta move Don't ever compare  Me to the rest They'll all get sliced and diced Competition's payin' the price  I'm gonna knock you out Mama said knock you out I'm gonna knock you out Mama said knock you out I'm gonna knock you out Mama said knock you out I'm gonna knock you out Mama said knock you out  Don't you call this no regular jam I'm gonna rock this land I'm gonna take this itty-bitty world by storm And I'm just getting warm Just like Mohammad Ali, they called him Cassius Watch me bash this  Beat like a skull Dontcha know I gotta beef wit' Why don't you rip with  Me, the maniac psycho Cuz when I pull out my jammy, get ready cuz it might go Blauh! How do you like me now? The ripper will not allow You to get wit' Mr. Smith don't risk Listen to my gear shift. I'm blastin', outlastin' Colors like shaft, so you could say I'm shaftin' Old English filled my mind  And I came up with the funky rhyme  I'm gonna knock you out Mama said knock you out I'm gonna knock you out Mama said knock you out I'm gonna knock you out Mama said knock you out I'm gonna knock you out Mama said knock you out  Breakdown!  Gangsta Boogie Gangsta Boogie Gangsta Boogie Gangsta Boogie Gangsta Boogie Gangsta Boogie Gangsta Boogie Gangsta Boogie Gangsta Boogie Gangsta Boogie Gangsta Boogie Gangsta Boogie Gangsta Boogie Gangsta Boogie Gangsta Boogie Gangsta Boogie  Shadow boxin' when I heard you on the radio Uh - I just don't know What made You forget that I was raw But now I gotta new toy I'm going insane Frontin' the hurricane Releasin' pain  Lettin' you know You can't gain or maintain Unless you say my name Rippin' Killin' Diggin' and drillin' a hole Pass the ol' goal  I'm gonna knock you out Mama said knock you out I'm gonna knock you out Mama said knock you out I'm gonna knock you out Mama said knock you out I'm gonna knock you out Mama said knock you out  Shotgun blasts are heard When I rip and kill at will The man of the hour, tower of power I will devour I'm gonna tie you up and let you understand That I'm not your average man When I gotta jammy in my hand Damn Ooh Listen to the way I slay your crew Damage Damage Damage Damage Destruction, terror and mayhem Pass me a sissy, and suckas I'll slay him Farmers (WHAT) Farmers (WHAT) I'm ready! (WE'RE READY) I think I'm gonna bomb a  Town (GET DOWN) Don't you never, ever Pull my lever 'Cause I explode And my nine is easy to load I gotta thank God 'Cause he gave me the strength to rock Hard... knock you out  Mama said knock you out I'm gonna knock you out Mama said knock you out I'm gonna knock you out Mama said knock you out I'm gonna knock you out Mama said knock you out  Damn;LL Cool J;Mama Said Knock You Out
aggressive;Jesus (Jesus)  Pick me, pick me yeah Let a lone, long signal At least, at least, yeah Everyone is hollow  Pick me, pick me yeah Everyone is waiting Pick me, pick me yeah You can even pay them  Hey  Dive Dive Dive Dive in me Dive Dive Dive Dive in me  Dive in me Dive in me Dive in me  Kiss this, kiss that yeah Let a lone, long signal At least, at least, yeah You could be my hero  Pick me, pick me yeah Everyone is waiting Hit me, hit me yeah I'm real good at hating  Hey  Dive Dive Dive Dive in me Dive Dive Dive Dive in me  Dive in me Dive in me Dive in me  Dive Dive Dive Dive in me Dive Dive Dive Dive in me Dive Dive Dive Dive in me  Dive in me Dive in me Dive in me Dive in me Dive in me Dive in me;Nirvana;Dive
acerbic;You're the kind of person you meet at certain  Dismal, dull affairs  Center of a crowd, talking much too loud  Running up and down the stairs   Well, it seems to me that you have seen  Too much in too few years  And though you've tried, you just can't hide  Your eyes are edged with tears   You better stop and look around  Here it comes, here it comes  Here it comes, here it comes  Here comes your nineteenth nervous breakdown   When you were a child, you were treated kind  But you were never brought up right  You were always spoiled with a thousand toys  But still you cried all night   Your mother who neglected you  Owes a million dollars tax  And your father's still perfecting ways  Of making sealing wax   You better stop and look around  Here it comes, here it comes  Here it comes, here it comes  Here comes your nineteenth nervous breakdown   Oh, who's to blame?  That girl's just insane  Well, nothing I do don't seem to work  It only seems to make matters worse, oh, please   You were still in school when you had that fool  Who really messed your mind  And after that you turned your back  On treating people kind   On our first trip, I tried so hard  To rearrange your mind  But after a while, I realized you were  Disarranging mine   You better stop and look around  Here it comes, here it comes  Here it comes, here it comes  Here comes your nineteenth nervous breakdown   Oh, who's to blame?  That girl's just insane  Well, nothing I do don't seem to work  It only seems to make matters worse, oh, please   When you were a child, you were treated kind  But you were never brought up right  You were always spoiled with a thousand toys  But still you cried all night   Your mother who neglected you  Owes a million dollars tax  And your father's still perfecting ways  Of making sealing wax   You better stop and look around  Here it comes  Here comes your nineteenth nervous breakdown  Here comes your nineteenth nervous breakdown  Here comes your nineteenth nervous breakdown  Here comes your nineteenth nervous breakdown  Here comes your nineteenth nervous breakdown  Here comes your nineteenth nervous breakdown;The Rolling Stones;19th Nervous Breakdown
