hostile;Honestly, somehow it always seems that I'm dreamin' of somethin' I can never be It doesn't matter to me 'cause I will Always be that pimp that I see in all of my fantasies  I don't know your fuckin' name So what, let's  Screamin' to be the only way that I can truly be free from my fucked-up reality So I dream and stroke it harder 'cause It's so fun to see my face starin' back at me  I don't know your fuckin' name So what, let's fuck  All day I dream about sex All day I dream about fuckin'  All day I dream about fuckin'  All day I dream about sex Yes, all day I dream about sex And all day I dream about sex Yes, all day I dream about sex And all day I dream about sex Yes, all day I dream about sex And all day I dream about sex Yes, all day I dream about sex  All day I dream about sex All day I dream about fuckin' All day I dream about sex All day I dream about fuckin';Korn;A.D.I.D.A.S.;;;;;;;;;;hostile;Ain't found a way to kill me yet Eyes burn with stinging sweat Seems every path leads me to nowhere, mmm Wife and kids, household pet Army green was no safe bet The bullets scream to me from somewhere, mmm  Here they come to snuff the rooster, oh yeah Yeah here come the rooster, yeah You know he ain't gonna die No, no, no oh, you know he ain't gonna die  Here they come to snuff the rooster, oh yeah Yeah here come the rooster, yeah You know he ain't gonna die, oh No, no, no oh, you know he ain't gonna die  Walkin' tall machine-gun men They spit on me in my homeland Gloria sent me pictures of my boy, mmm Got my pills 'gainst mosquito death My buddy's breathing his dyin' breath Oh God, please, won't you help me make it through?  Here they come to snuff the rooster, oh yeah Yeah, here come the rooster, yeah You know he ain't gonna die No, no, no oh, you know he ain't gonna die;Alice in Chains;Rooster;;;;;;;;;;hostile;Bury me softly in this womb I give this part of me for you Sand rains down and here I sit Holding rare flowers in a tomb, in bloom  Down in a hole and I don't know if I can be saved See my heart, I decorate it like a grave You don't understand who they thought I was supposed to be Look at me now, a man who won't let himself be  Down in a hole Feeling so small Down in a hole Losing my soul  I'd like to fly But my wings have been so denied  Down in a hole, and they've put all the stones in their place I've eaten the sun so my tongue has been burned of the taste I have been guilty of kicking myself in the teeth I will speak no more of my feelings beneath  Down in a hole Feeling so small Down in a hole Losing my soul  I'd like to fly But my wings have been so denied  Bury me softly in this womb (Oh I want to be inside of you) I give this part of me for you (Oh I want to be inside of you) Sand rains down and here I sit Holding rare flowers (Oh I want to be inside of you) In a tomb (Oh I want to be inside)  Down in a hole Feeling so small Down in a hole Losing my soul Down in a hole Feeling so small Down in a hole Out of control I'd like to fly But my wings have been so denied;Alice in Chains;Down in a Hole;;;;;;;;;;hostile;I believe them bones are me Some say we're born into the grave  I feel so alone, gonna end up A big old pile of them bones  Dust rise, right on over my time Empty, fossil of the new scene  I feel so alone, gonna end up A big old pile of them bones  Toll due, bad dream come true I lie dead, gone under red sky  I feel so alone, gonna end up A big old pile of them I feel so alone, gonna end up A big old pile of them I feel so alone, gonna end up A big old pile of them bones;Alice in Chains;Them Bones;;;;;;;;;;hostile;Do you mean this horny creep Set upon weary feet Who looks in need of sleep That doesn't come  This twisted, tortured mess This bed of sinfulness Who's longing for some rest And feeling numb  What do you expect of me? What is it you want? Whatever you've planned for me I'm not the one  A vicious appetite Visits me each night And won't be satisfied Won't be denied  An unbearable pain A beating in my brain That leaves the mark of Cain Right here inside  What am I supposed to do When everything that I've done Is leading me to conclude I'm not the one?  Whatever I've done I've been staring down the barrel of a gun Whatever I've done I've been staring down the barrel of a gun Whatever I've done (whatever, whatever)  Is there something you need from me? Are you having your fun? I never agreed to be Your holy one  Whatever I've done I've been staring down the barrel of a gun Whatever I've done (whatever, whatever) I've been staring down the barrel of a gun Whatever I've done (whatever, whatever) I've been staring down the barrel of a gun;Depeche Mode;Barrel of a Gun;;;;;;;;;;hostile;Sweet dreams are made of these Who am I to disagree? Travel the world and the seven seas Everybody's looking for something Some of them want to use you Some of them want to get used by you Some of them want to abuse you Some of them want to be abused  Sweet dreams are made of these Who am I to disagree? Travel the world and the seven seas Everybody's looking for something Some of them want to use you Some of them want to get used by you Some of them want to abuse you Some of them want to be abused  I wanna use you and abuse you I wanna know what's inside you Moving on, moving on Moving on, moving on Moving on, moving on Moving on  Sweet dreams are made of these Who am I to disagree? Travel the world and the seven seas Everybody's looking for something Some of them want to use you Some of them want to get used by you Some of them want to abuse you Some of them want to be abused  I'm gonna use you and abuse you I'm gonna know what's inside Gonna use you and abuse you I'm gonna know what's inside you;Marilyn Manson;Sweet Dreams (Are Made of This);;;;;;;;;;joyous;If I listened long enough to you I'd find a way to believe that it's all true Knowing that you lied Straight-faced while I cried Still I look to find a reason to believe  Someone like you Makes it hard to live without somebody else Someone like you Makes it easy to give Never think about myself  If I gave you time to change my mind I'd find a way just to leave the past behind Knowing that you lied Straight-faced while I cried Still I look to find a reason to believe  If I listened long enough to you I'd find a way to believe that it's all true Knowing that you lied Straight-faced while I cried Still I look to find a reason to believe  Someone like you  Makes it hard to live without somebody else Someone like you  Makes it easy to give Never think about myself  Someone like you  Makes it hard to live without somebody else Someone like you  Makes it easy to give Never think about myself  Someone like you  Makes it hard to live without somebody else Someone like you Makes it easy to give Never think about myself, wooh  Someone like you  Makes it hard to live without somebody else Someone like you  Makes it easy to give Never think about myself  Someone like you  Makes it hard to live without somebody else;Rod Stewart;Reason to Believe;;;;;;;;;;joyous;I should have known better with a girl like you That I would love everything that you do And I do, hey hey hey, and I do  Whoa, whoa, I never realised what a kiss could be This could only happen to me Can't you see, can't you see?  That when I tell you that I love you, oh You're gonna say you love me too, oh And when I ask you to be mine You're gonna say you love me too  So I should have realised a lot of things before If this is love you gotta give me more Give me more, hey hey hey, give me more  Whoa, whoa, I never realised what a kiss could be This could only happen to me Can't you see, can't you see?  That when I tell you that I love you, oh You're gonna say you love me too, oh And when I ask you to be mine You're gonna say you love me too You love me too You love me too You love me too;The Beatles;I Should Have Known Better;;;;;;;;;;joyous;Any time at all Any time at all Any time at all All you gotta do is call And I'll be there  If you need somebody to love Just look into my eyes I'll be there to make you feel right If you're feeling sorry and sad I'd really sympathise Don't you be sad Just call me tonight  Any time at all Any time at all Any time at all All you gotta do is call And I'll be there  If the sun has faded away I'll try to make it shine There is nothing I won't do When you need a shoulder to cry on I hope it will be mine Call me tonight and I'll come to you  Any time at all Any time at all Any time at all All you gotta do is call And I'll be there  Any time at all Any time at all Any time at all All you gotta do is call And I'll be there  Any time at all All you gotta do is call And I'll be there;The Beatles;Any Time at All;;;;;;;;;;joyous;Whoa, I Whoa, I I got a whole lot of thing to tell her When I get home  Come on, out my way 'Cos I'm a-gonna see my baby today I got a whole lot of things I gotta say To her  Whoa, I Whoa, I I got a whole lot of things to tell her When I get home  Come on, if you please I got no time for triviality I got a girl who's waiting home for me Tonight  Whoa, I Whoa, I I got a whole lot of thing to tell her When I get home  When I get'n home tonight I'm gonna hold her tight I'm gonna love her till the cows come home I bet'n I'll love her more Till I walk out that door Again  Come on, let me through I got so many things I gotta do I got no business being here with you This way  Whoa, I Whoa, I I got a whole lot of things to tell her When I get home, yeah I got a whole lot of thing to tell her When I get home;The Beatles;When I Get Home;;;;;;;;;;joyous;Ooh, I need your love, babe Guess you know it's true Hope you need my love, babe Just like I need you  Hold me, love me Hold me, love me I ain't got nothin' but love, babe Eight days a week  Love you every day, girl Always on my mind One thing I can say, girl Love you all the time  Hold me, love me Hold me, love me I ain't got nothin' but love, girl Eight days a week  Eight days a week I love you Eight days a week Is not enough to show I care  Ooh, I need your love, babe Yes, you know it's true Hope you need my love, babe Just like I need you  Oh, hold me, love me Hold me, love me I ain't got nothin' but love, babe Eight days a week  Eight days a week I love you Eight days a week Is not enough to show I care  Love you every day, girl Always on my mind One thing I can say, girl Love you all the time  Hold me, love me Hold me, love me I ain't got nothin' but love, babe Eight days a week  Eight days a week Eight days a week;The Beatles;Eight Days a Week;;;;;;;;;;joyous;Roll up, roll up for the Magical Mystery Tour! Step right this way!  Roll up Roll up for the Mystery Tour Roll up Roll up for the Mystery Tour  Roll up (That's an invitation) Roll up for the Mystery Tour Roll up (To make a reservation) Roll up for the Mystery Tour  The Magical Mystery Tour Is waiting to take you away Waiting to take you away  Roll up Roll up for the Mystery Tour Roll up Roll up for the Mystery Tour  Roll up (We got everything you need) Roll up for the Mystery Tour Roll up (Satisfaction guaranteed) Roll up for the Mystery Tour  The Magical Mystery Tour Is hoping to take you away Hoping to take you away  Mystery trip Ah The Magical Mystery Tour Roll up Roll up for the Mystery Tour  Roll up (That's an invitation) Roll up for the Mystery Tour Roll up (To make a reservation) Roll up for the Mystery Tour  The Magical Mystery Tour Is coming to take you away Coming to take you away  The Magical Mystery Tour Is dying to take you away Dying to take you away Take you today;The Beatles;Magical Mystery Tour;;;;;;;;;;joyous;In Penny Lane there is a barber showing photographs Of every head he's had the pleasure to know And all the people that come and go Stop and say hello  On the corner is a banker with a motorcar The little children laugh at him behind his back And the banker never wears a mac In the pouring rain Very strange  Penny Lane is in my ears and in my eyes There beneath the blue suburban skies I sit and meanwhile back  In Penny Lane, there is a fireman with an hour glass And in his pocket is a portrait of the Queen He likes to keep his fire engine clean It's a clean machine  Penny Lane is in my ears and in my eyes Four of fish and finger pies in summer Meanwhile back  Behind the shelter in the middle of the roundabout A pretty nurse is selling poppies from a tray And though she feels as if she's in a play She is anyway  In Penny Lane the barber shaves another customer We see the banker sitting waiting for a trim And then the fireman rushes in From the pouring rain Very strange  Penny Lane is in my ears and in my eyes There beneath the blue suburban skies I sit and meanwhile back  Penny Lane is in my ears and in my eyes There beneath the blue suburban skies Penny Lane;The Beatles;Penny Lane;;;;;;;;;;joyous;Close your eyes and I'll kiss you Tomorrow I'll miss you Remember I'll always be true And then while I'm away I'll write home every day And I'll send all my loving to you  I'll pretend that I'm kissing The lips I am missing And hope that my dreams will come true And then while I'm away I'll write home every day And I'll send all my loving to you  All my loving I will send to you All my loving Darling, I'll be true  Close your eyes and I'll kiss you Tomorrow I'll miss you Remember I'll always be true And then while I'm away I'll write home every day And I'll send all my loving to you  All my loving I will send to you All my loving Darling, I'll be true  All my loving All my loving, ooh All my loving I will send to you;The Beatles;All My Loving;;;;;;;;;;joyous;Ridin' on the City of New Orleans Illinois Central Monday morning rail Fifteen cars and fifteen restless riders Three conductors and twenty-five sacks of mail All along the southbound odyssey the train pulls out of Kankakee And rolls along past houses farms and fields Passing trains that have no name and graveyards full of old black men And graveyards full of rusted automobiles  Good morning America how are you?  Say, don't you know me I'm your native son I'm the train they call the City of New Orleans And I'll be gone five hundred miles when the day is done  Dealin' cards with an old man in the club car Penny a point, ain't no one keepin' score Pass that paper bag that holds the bottle And feel the wheels a rumbling neath the floor And the sons of poor men porters and the sons of engineers Ride their father's magic carpet made of steel Mothers with their babes asleep rockin' to that gentle beat And the rhythm of the rails is all they feel  Good morning America how are you?  Say, don't you know me I'm your native son I'm the train they call the City of New Orleans And I'll be gone five hundred miles when the day is done  Night time on the City of New Orleans changing cars in Memphis Tennessee Half way home we'll be there by morning Through the Mississippi darkness rolling down to the sea And all the towns and people seem to fade into a bad dream And the steel rails still ain't heard the news The conductor sings his songs again the passengers will please refrain This train has got the disappearing railroad blues  Good morning America how are you?  Say, don't you know me I'm your native son I'm the train they call the City of New Orleans And I'll be gone five hundred miles when the day is done;Willie Nelson;City of New Orleans;;;;;;;;;;joyous;O beautiful for spacious skies, For amber waves of grain, For purple mountain majesties Above the fruited plain! America! America! God shed his grace on thee And crown thy good with brotherhood From sea to shining sea!  O beautiful for pilgrim feet Whose stern impassioned stress A thoroughfare of freedom beat Across the wilderness! America! America! God mend thine every flaw, Confirm thy soul in self-control, Thy liberty in law!  O beautiful for heroes proved In liberating strife. Who more than self their country loved And mercy more than life! America! America! May God thy gold refine Till all success be nobleness And every gain divine!  O beautiful for patriot dream That sees beyond the years Thine alabaster cities gleam Undimmed by human tears! America! America! God shed his grace on thee And crown thy good with brotherhood From sea to shining sea!  O beautiful for halcyon skies, For amber waves of grain, For purple mountain majesties Above the enameled plain! America! America! God shed his grace on thee Till souls wax fair as earth and air And music-hearted sea!  O beautiful for pilgrims feet, Whose stem impassioned stress A thoroughfare for freedom beat Across the wilderness! America! America! God shed his grace on thee Till paths be wrought through Wilds of thought By pilgrim foot and knee!  O beautiful for glory-tale Of liberating strife When once and twice, For man's avail Men lavished precious life! America! America! God shed his grace on thee Till selfish gain no longer stain The banner of the free!  O beautiful for patriot dream That sees beyond the years Thine alabaster cities gleam Undimmed by human tears! America! America! God shed his grace on thee Till nobler men keep once again Thy whiter jubilee!;Frank Sinatra;America the Beautiful;;;;;;;;;;joyous;Tell me why baby, why baby, why baby, why You make me cry baby, cry baby, cry baby, cry I can't help but love you 'til the day that I die So tell me, why baby, why baby, why baby, why  Well I got a crow I wanna pick with you Just like last time when the feathers flew You're runnin' wild kickin' up your heels A leavin' me home with a hand full of bills  Well, I can't live without you and you know it's true But there's no livin' with you so what'll I do I'm goin' honky tonkin', get as tight as I can And maybe by then you'll 'preciate a good man  Tell me why baby, why baby, why baby, why You make me cry baby, cry baby, cry baby, cry  I can't help but love you 'til the day that I die So tell me why baby, why baby, why baby, why  Well, now I don't know, but I've heard say That ever' little dog is a gonna have his day You'd better pay attention, don't you dare forget 'Cause I'm just a little bitty puppy. yet  Yeah, I caught you honky tonkin' with my best friend The thing to do was leave you, but I should'a left then Now I'm too old to leave you, but I still get sore When you come home a feelin' for the knob on the door  Tell me why baby, why baby, why baby, why You make me cry baby, cry baby, cry baby, cry I can't help but love you 'til the day that I die So tell me, why baby, why baby, why baby, why...;George Jones;Why Baby Why;;;;;;;;;;joyous;(My my my my my)  Don't you worry 'bout what's on your mind, oh my I'm in no hurry, I can take my time, oh my I'm going red and my tongue's getting tied (tongue's getting tied) I'm off my head and my mouth's getting dry I'm high, but I try, try, try, oh my  Let's spend the night together Now I need you more than ever Let's spend the night together now  I feel so strong that I can't disguise, oh my (Let's spend the night together) But I just can't apologize, oh no (Let's spend the night together) Don't hang me up and don't let me down (don't let me down) We could have fun just groovin' around Around, around, around, oh my  Let's spend the night together Now I need you more than ever Let's spend the night together  Let's spend the night together Now I need you more than ever You know I'm smiling, baby  You need some guiding, baby I'm just deciding, baby, now I need you more than ever Let's spend the night together Let's spend the night together now Oh my my my my my my my  This doesn't happen to me ev'ry day, oh my (Let's spend the night together) No excuses offered anyway, oh my (Let's spend the night together) I'll satisfy your every need (your every need) And now I know you will satisfy me Oh my my my my my my  Let's spend the night together Now I need you more than ever Let's spend the night together Together now, Oh my my my my my my my  (Let's spend the night together) Now I need you, need you more than ever, oh my (Let's spend the night together) I'll satisfy your every need, whoa my my (Let's spend the night together) Now I know, I know you'll satisfy me, whoa my my (Let's spend the night together) I beg you baby, whoa my my my my my my (Let's spend the night together) A-c'mon now, whoa baby my my my (Let's spend the night together);The Rolling Stones;Let's Spend the Night Together;;;;;;;;;;joyous;Everybody say yeah (yeah!) Say yeah (yeah!) Say yeah (yeah!) Yeah Yeah Yeah Yeah  Just a little bit of sou-ou-ou-ou-oul Yeah yeah yeah yeah yeah yeah Clap your hands just a little bit louder Clap your hands just a little bit louder  I know yeah Everybody had a good time So if you want me to If you want me to I'm gonna swing the song, yeah Just one more time when I come by Just one more time when I come by So be advised (?)  Come on Goodbye goodbye Goodbye goodbye Goodbye goodbye goodbye I'm gonna go, yeah I'm gonna go, yeah;Stevie Wonder;Fingertips, Pt. 2;;;;;;;;;;joyous;1 - 2 - 3 - 4   Well, she was just seventeen You know what I mean And the way she looked was way beyond compare So how could I dance with another And I saw her standing there  Well, she looked at me, and I, I could see That before too long, I'd fall in love with her She wouldn't dance with another And I saw her standing there  Well, my heart went boom When I crossed that room And I held her hand in mine  Whoah, we danced through the night And we held each other tight And before too long, I fell in love with her Now, I'll never dance with another Since I saw her standing there  Well, my heart went boom When I crossed that room And I held her hand in mine  Whoah, we danced through the night And we held each other tight And before too long, I fell in love with her Now, I'll never dance with another Since I saw her standing there;Paul McCartney;I Saw Her Standing There;;;;;;;;;;joyous;I can almost remember their funny faces That time you told 'em that you were going to be marrying soon And Jet I thought the only lonely place was on the moon   Was your father as bold as a sergeant major? Well how come he told you that you were hardly old enough yet? And Jet I thought the major was a lady sufragette   Ah, mater, want Jet to always love me? Ah, mater, much later   With the wind in your hair of a thousand laces Climb on the back and we'll go for a ride in the sky And Jet I thought the major was a little lady suffragette   And Jet You know I thought you was a little lady suffragette   A little lady, my little lady yes!;Paul McCartney;Jet;;;;;;;;;;joyous;Can't see nothin' in front of me  Can't see nothin' coming up behind  I make my way through this darkness  I can't feel nothing but this chain that binds me   Lost track of how far I've gone  How far I've gone, how high I've climbed  On my back's a sixty pound stone  On my shoulder a half mile of line   Come on up for the rising  Come on up, lay your hands in mine  Come on up for the rising  Come on up for the rising tonight   Left the house this morning  Bells ringing filled the air  I was wearin' the cross of my calling  On wheels of fire I come rollin' down here   Come on up for the rising  Come on up, lay your hands in mine  Come on up for the rising  Come on up for the rising tonight  Lalala...  There's spirits above and behind me  Faces gone black, eyes burnin' bright  May their precious blood bind me  Lord, as I stand before your fiery light   Lalala...  I see you, Mary, in the garden  In the garden of a thousand sighs  There's holy pictures of our children  Dancin' in a sky filled with light   May I feel your arms around me  May I feel your blood mixed with mine  A dream of life comes to me  Like a catfish dancin' on the end of my line   Sky of blackness and sorrow (A dream of life)  Sky of love, sky of tears (A dream of life)  Sky of glory and sadness (A dream of life)  Sky of mercy, sky of fear (A dream of life)   Sky of memory and shadow (A dream of life)  Your burnin' wind fills my arms tonight  Sky of longing and emptiness (A dream of life)  Sky of fullness, sky of blessed life   Come on up for the rising  Come on up, lay your hands in mine  Come on up for the rising  Come on up for the rising tonight  Lalala...;Bruce Springsteen;The Rising;;;;;;;;;;joyous;Ah... Oo...  This is the way I always dreamed it would be The way that it is, oh When you are holding me I never had a love of my own Maybe that's why when we're all alone  I can hear music I can hear music The sound of the city baby Seems to disappear, oh when I can hear music Sweet sweet music Whenever you touch me baby Whenever you're near  Loving you It keeps me satisfied  And I can't explain, oh no The way I'm feeling inside You look at me, we kiss and then I close my eyes and here it comes again  I can hear music I can hear music The sound of the city baby Seems to disappear, oh when I can hear music Sweet sweet music Whenever you touch me baby Whenever you're near  I hear the music all the time, yeah I hear the music hold me tight now baby I hear the music all the time I hear the music I hear the music (baby)  Ahh...  I can hear music I can hear music The sound of the city baby  Seems to disappear, oh when I can hear music Sweet sweet music Whenever you touch me baby Whenever you're near;The Beach Boys;I Can Hear Music;;;;;;;;;;joyous;"Let's take it nice and easy It's gonna be so easy For us to fall in love  Hey baby what's your hurry Relax and don't you worry We're gonna fall in love  We're on the road to romance - that's safe to say But let's make all the stops along the way  The problem now of course is  To simply hold your horses To rush would be a crime 'Cause nice and easy does it  Nice 'n' easy does it Nice 'n' easy does it every time   ""Like the man says, 'one more time' ""  Nice 'n' easy does it Nice 'n' easy does it Nice 'n' easy does it every time";Frank Sinatra;Nice 'n' Easy;;;;;;;;;;