bright;He's a real nowhere man  Sitting in his nowhere land  Making all his nowhere plans for nobody  Doesn't have a point of view  Knows not where he's going to  Isn't he a bit like you and me?   Nowhere man, please listen (aaah-ah-la-la-la) You don't know what you're missing (aaah-ah-la-la-la) Nowhere man (aaah-ah-la-la-la) The world is at your command (aaah-aah-lala-lala-la)  He's as blind as he can be  Just sees what he wants to see  Nowhere man, can you see me at all?  Nowhere man, don't worry (aaah-ah-la-la-la) Take your time; don't hurry (aaah-ah-la-la-la) Leave it all (aaah-ah-la-la-la) Till somebody else lends you a hand (aaah-aah-lala-lala)  Doesn't have a point of view  Knows not where he's going to  Isn't he a bit like you and me?   Nowhere man please listen (aaah-ah-la-la-la) You don't know what you're missing (aaah-ah-la-la-la) Nowhere man (aaah-ah-la-la-la) The world is at your command (aaah-aah-lala-lala)  He's a real nowhere man  Sitting in his nowhere land  Making all his nowhere plans for nobody  Making all his nowhere plans for nobody  Making all his nowhere plans for nobody;The Beatles;Nowhere Man;;;;;;;;;bright;My love don't give me presents  I know that she's no peasant  Only ever has to give me  Love forever and forever  My love don't give me presents   Turn me on when I get lonely  People tell me that she's only fooling  I know she isn't   She don't give boys the eye  She hates to see me cry  She is happy just to hear me  Say that I will never leave her  She don't give boys the eye   She will never make me jealous  Gives me all her time as well as loving  Don't ask me why   She's a woman who understands  She's a woman who loves her man   My love don't give me presents  I know that she's no peasant  Only ever has to give me  Love forever and forever  My love don't give me presents   Turn me on when I get lonely  People tell me that she's only fooling  I know she isn't  Whoooo, whoo  She's a woman who understands  She's a woman who loves her man   My love don't give me presents I know that she's no peasant Only ever has to give me Love forever and forever My love don't give me presents  Turn me on when I get lonely People tell me that she's only fooling I know she isn't  She's a woman She's a woman She's a woman She's a woman She's my woman;The Beatles;She's a Woman;;;;;;;;;;bright;How do you think I feel? Well, I know your love's not real The girl I'm mad about is just a gadabout How do you think I feel?  How do you think we stand? Well, I know you've made your plans But you've included three And that's too much for me How do you think I feel?  I won't be true again I know that I can't win So why should I pretend That you still love me?  How do you think I feel? Well, I know your love's not real The one I'm mad about is just a gadabout How do you think I feel?  How do you think I feel? Well, I know your love's not real The girl I'm mad about is just a gadabout How do you think I feel?  Well, how do you think we stand? I know you've made your plans Another's pretty face Has put me out of place How do you think I feel?  I won't be true again I know that I can't win So why should I pretend That you still love me?  How do you think I feel? Well, I know your love's not real And you've included three And that's too much for me How do you think I feel?;Elvis Presley;How Do You Think I Feel;;;;;;;;;;bright;Her hair is soft and her eyes are oh so blue . She's all the things a girl should be, but she's not you.  She knows just how to make me laugh when I feel blue, She's ev'rything a man could want, but she's not you.   And when we're dancing, it almost feels the same. I've got to stop myself from whisp'ring your name  She even kisses me like you used to do.  And it's just breaking my heart  'cause she's not you. And it's just breaking my heart  'cause she's not you.  And when we're dancing, it almost feels the same. I've got to stop myself from whisp'ring your name. She even kisses me like you used to do.  And it's just breaking my heart  'cause she's not you. And it's just breaking my heart  'cause she's not you.;Elvis Presley;She's Not You;;;;;;;;;;bright;Under my thumb The girl who once had me down Under my thumb The girl who once pushed me around  It's down to me The difference in the clothes she wears Down to me The change has come She's under my thumb Ain't it the truth, babe?  Under my thumb Is a squirmin' dog who's just had her day Under my thumb A girl who has just changed her ways  It's down to me, yes, it is The way she does just what she's told Down to me The change has come She's under my thumb Say, it's all right  Under my thumb Is a Siamese cat of a girl Under my thumb She's the sweetest, oo, pet in the world  It's down to me The way she talks when she's spoken to Down to me The change has come She's under my thumb Uh, take it easy, babe Yeah  It's down to me, oh, yeah The way she talks when she's spoken to Down to me The change has come She's under my thumb Yeah, it feels all right  Under my thumb Her eyes are just kept to herself Under my thumb Well, I, I can still look at someone else It's down to me, ih, that's what I said The way she talks when she's spoken to Down to me The change has come She's under my thumb Say, it's all right Ah, ah Say, it's all right, oh Say, it's all right Ah, ah Ah, ah-ah-ah-ah Ah, ah-ah Ah Take it easy, babe, ah Take it easy, babe, ah Feels all right, ah Take it, take it easy, babe Take it easy;The Rolling Stones;Under My Thumb;;;;;;;;;;bright;You don't know what's going on  You've been away for far too long  You can't come back and think you are still mine  You're out of touch, my baby  My poor discarded baby  I said, baby, baby, baby, you're out of time   Well, baby, baby, baby, you're out of time  I said, baby, baby, baby, you're out of time  You are all left out  Out of there without a doubt  'Cause, baby, baby, baby, you're out of time   You thought you were a clever girl  Giving up your social whirl  But you can't come back and be the first in line, oh no  You're obsolete, my baby  My poor old-fashioned baby  I said, baby, baby, baby, you're out of time   Well, baby, baby, baby, you're out of time  I said, baby, baby, baby, you're out of time  Yes, you are left out  Out of there without a doubt  'Cause, baby, baby, baby, you're out of time   I said,  baby, baby, you're out of time;The Rolling Stones;Out of Time;;;;;;;;;;bright;"You're just too marvelous Too marvelous for words Like ""glorious"", ""glamorous""  And that old standby ""amorous"" It's all too wonderful I'll never find the words That say enough, tell enough I mean they just aren't swell enough  You're much too much And just too very very Too ever be in Webster's dictionary And so I'm borrowing A lovesong from the birds To tell you that you're marvelous Too marvelous for words  You're much, you're too much And just too ""very, very"" To ever be, to ever be In Webster's dictionary And so I'm borrowing A love-song from the birds To tell you that you're marvelous To tell you that you're marvelous To tell you that you're marvelous Too marvelous for words";Frank Sinatra;Too Marvelous for Words;;;;;;;;;;bright;Writer(s): B. Lane/ E.Y. Harburg    I look at you and suddenly, Something in your eyes I see; Soon begins bewitching me. It's that old devil moon; That you stole from the skies. It's that old devil moon in your eyes.  You and you glance; Make this romance; Too hot to handle. Stars in the night; Blazing their light; Can't hold a candle; To your razzle-dazzle.  You've got me flyin' high and wide; On a magic carpet ride; Full of butterflies inside. Wanna cry, wanna croon, Wanna laugh like a loon. It's that old devil moon in your eyes.  Just when I think, I'm; Free as a dove. Old devil moon, Deep in your eyes, Blinds me with love.;Frank Sinatra;Old Devil Mooncelebratory;Roll up, roll up for the Magical Mystery Tour! Step right this way!  Roll up Roll up for the Mystery Tour Roll up Roll up for the Mystery Tour  Roll up (That's an invitation) Roll up for the Mystery Tour Roll up (To make a reservation) Roll up for the Mystery Tour  The Magical Mystery Tour Is waiting to take you away Waiting to take you away  Roll up Roll up for the Mystery Tour Roll up Roll up for the Mystery Tour  Roll up (We got everything you need) Roll up for the Mystery Tour Roll up (Satisfaction guaranteed) Roll up for the Mystery Tour  The Magical Mystery Tour Is hoping to take you away Hoping to take you away  Mystery trip Ah The Magical Mystery Tour Roll up Roll up for the Mystery Tour  Roll up (That's an invitation) Roll up for the Mystery Tour Roll up (To make a reservation) Roll up for the Mystery Tour  The Magical Mystery Tour Is coming to take you away Coming to take you away  The Magical Mystery Tour Is dying to take you away Dying to take you away Take you today;The Beatles;Magical Mystery Tour;;;;;;;;;;celebratory;It's Mr. 305 checkin' in for the remix You know it is 75 Street Brazil Well this year gon' be called Calle Ocho Que bola Cada, que bola Omega And this how we gon' do it Dale  One, two, three, four Uno, dos, tres, cuatro  I know you want me (want me) You know I want ya (want ya) I know you want me You know I want ya (want ya)  I know you want me (want me) You know I want ya (want ya) I know you want me You know I want ya (want ya)  One, two, three, four Uno, dos, tres, cuatro  Rumba (si)  Ella quiere su Rumba (como?)  Rumba (si)  Ella quiere su Rumba (como?)   Que verdad que tu eres guapa Yo te voy a poner gozar  Tu tiene la boca grande  Dale ponte a jugar (como)   One, two, three, four Uno, dos, tres, cuatro  Tick to the tock, on my way to the top, uh Pit got it locked from goons to the locks R.I.P. uh, Big and Pac That he's not, but damn he's hot Label flop but Pit won't stop Got her in the cockpit playin' with Pit's dick Now watch me make a movie like Albert Hitchcock, enjoy me  I know you want me (want me) You know I want ya (want ya) I know you want me You know I want ya (want ya)  I know you want me (want me) You know I want ya (want ya) I know you want me You know I want ya (want ya)  One, two, three, four Uno, dos, tres, cuatro  Rumba (si)  Ella quiere su Rumba (como?)  Rumba (si)  Ella quiere su Rumba (como?)   Que verdad que tu eres guapa Yo te voy a poner gozar  Tu tiene la boca grande  Dale ponte a jugar (como)   One, two, three, four Uno, dos, tres, cuatro  Mami got an ass like a donkey, with a monkey Look like King Kong, welcome to the crib 305, that's what it is When the women down here are the shit They don't play games They off the chain, and they love to do everything and anything, anything And they love to get it in, get it on, all night long (dale)  I know you want me (want me) You know I want ya (want ya) I know you want me You know I want ya (want ya)  I know you want me (want me) You know I want ya (want ya) I know you want me You know I want ya (want ya)  One, two, three, four Uno, dos, tres, cuatro  Rumba (si)  Ella quiere su Rumba (como?)  Rumba (si)  Ella quiere su Rumba (como?)   Que verdad que tu ere guapa Yo te voy a poner gozar  Tu tiene la boca grande  Dale ponte a jugar (como)   One, two, three, four Uno, dos, tres, cuatro  Baby, you can get it, if you wit' it, we can play Baby I got cribs, I got condos we can stay Even got a king-size mattress we can lay Baby, I don't care, I don't care what they say  I know you want me (want me) You know I want ya (want ya) I know you want me You know I want ya (want ya)  I know you want me (want me) You know I want ya (want ya) I know you want me You know I want ya (want ya)  One, two, three, four Uno, dos, tres, cuatro  Rumba (si)  Ella quiere su Rumba (como?)  Rumba (si)  Ella quiere su Rumba (como?)   Que verdad que tu ere guapa Yo te voy a poner gozar  Tu tiene la boca grande  Dale ponte a jugar (como)   One, two, three, four Uno, dos, tres, cuatro;Pitbull;I Know You Want Me (Calle Ocho);;;;;;;;;;celebratory;I'm gonna sit right down and cry over you I'm gonna sit right down and cry over you And if you say good-bye If you ever even try  I'm gonna sit right down and cry over you I'm gonna love you more and more every day I'm gonna love you more and more in every way And if you say good-bye If you ever even try  I'm gonna sit right down and cry over you I'm gonna tell my mama tell my papa too So they'll know exactly what I'm gonna do And if you say good-bye Say if you ever even try;Elvis Presley;I'm Gonna Sit Right Down and Cry (Over You);;;;;;;;;;celebratory;I feel it in my leg, I feel it in my shoe Tell me pretty baby If you think you feel it too Let's have a party Let's have a party Send to the store And let's buy some more And let's have a party tonight  Some people like to rock Some people like to roll But movin' and a groovin' Gonna satisfy my soul  I've never kissed a bear I've never kissed a goon But I can shake a chicken In the middle of the room  Now Honky Tonky Joe Is knockin' at the door Bring him in and fill him up And set him on the floor;Elvis Presley;Party;;;;;;;;;;celebratory;Hot dog, you say you're really coming back Hot dog, I'm waiting at the railway track Hot dog, you say you're coming home for good Hot dog, I'm going to keep knocking on wood And baby, I can hardly wait I'm gonna meet you at the gate, hot dog  I fell in love with you and then you went away But now you're coming home to stay Hot dog, soon everything will be all right Hot dog, we're gonna have a ball tonight I've got a pocketful of dimes It's gonna be just like old times, hot dog  You went away and every day was misery But now you're coming back to me Hot dog, my heart is gonna go insane Hot dog, when you come walking off the train Oh how lonely I have been But when that Santa Fe pulls in Hot dog, baby, baby, hot dog;Elvis Presley;Hot Dog;;;;;;;;;;celebratory;Rock steady, baby - That's what I feel now Let's call this song exactly what it is  Step n' move your hips with a feelin' from side to side Sit yourself down in your car and take a ride And while you're movin', rock steady, rock steady, baby Let's call this song exactly what it is (What it is, what it is, what it is) It's a funky and low down feelin' (What it is) In my hips from left to right (What it is) What it is is I might be doin' (What it is) This funky dance all night Oh, oh! (Clap your hands in the air! Got a feelin', ain't got a care!) Oh-ah! (What fun to take this ride! Rock steady will only slide!)  Rock steady! Rock steady, baby Rock steady! Rock steady, baby  Step n' move your hips with a feelin' from side to side Sit yourself down in your car and take a ride And while you're movin', rock steady, rock steady Let's call this song exactly what it is (What it is, what it is, what it is) It's a funky and low down feelin' (What it is) In my hips from left to right (What it is) What it is is I might be doin' (What it is) This funky dance all night Oh-ah! (Clap your hands in the air! Got a feelin', ain't got a care!) Oh-ah! (What fun to take this ride! Rock steady will only slide!)  Rock steady, baby! Rock steady whoo! Rock steady  Rock! Steady! Rock! Steady!  (What it is) It's a funky and low down feelin' (What it is) In my hips from left to right (What it is) What it is is I might be doin' (What it is) This funky dance all night Oh, ah! (Clap your hands in the air! Got a feelin', ain't got a care!) Oh-ah! (What fun to take this ride! Rock steady will only slide!)  Rock steady! Steady it, baby! Rock rock steady, baby Baby (What it is) Baby, baby (What it is) Baby (What it is) Baby;Aretha Franklin;Rock Steady;;;;;;;;;;celebratory;A very old friend came by today 'cause he was telling everyone in town About the love that he just found And Marie's the name of his latest flame  He talked and talked and I heard him say That she had the longest blackest hair The prettiest green eyes anywhere And Marie's the name of his latest flame  Though I smiled the tears inside were a-burning I wished him luck and then he said goodbye He was gone but still his words kept returning What else was there for me to do but cry  Would you believe that yesterday This girl was in my arms and swore to me She'd be mine eternally And Marie's the name of his latest flame  Though I smiled the tears inside were a-burning I wished him luck and then he said goodbye He was gone but still his words kept returning What else was there for me to do but cry  Would you believe that yesterday This girl was in my arms and swore to me She'd be mine eternally And Marie's the name of his latest flame;Elvis Presley;(Marie's the Name) His Latest Flame;;;;;;;;;;celebratory;"(Dance, boogie wonderland, ah, ah Dance, boogie wonderland)  Midnight creeps so slowly into hearts Of men who need more than they get Daylight deals a bad hand To a woman who has laid too many bets  The mirror stares you in the face and says ""Baby, uh uh, it don't work"" You say your prayers, though you don't care You dance and shake the hurt  (Dance, boogie wonderland, ah, ah Dance, boogie wonderland)  Sound fly through the night I chase my vinyl dreams to boogie wonderland  (I find romance when I start to dance in boogie wonderland I find romance when I start to dance in boogie wonderland)  (All the love in the world can't be gone All the need to be loved can't be wrong All the records are playing And my heart keeps saying Boogie wonderland, wonderland)  (Dance, boogie wonderland, ah, ah Dance, boogie wonderland, ah, ah)  (I find romance when I start to dance in boogie wonderland I find romance when I start to dance in boogie wonderland)  (Dance, boogie wonderland, ah, ah Dance, boogie wonderland, ah, ah)  (Hm-hm-hm-hm, hm-hm-hm-hm, hm-hm-hm-hm, wonderland Hm-hm-hm-hm, hm-hm-hm-hm, hm-hm-hm-hm, wonderland Hm-hm-hm-hm, hm-hm-hm-hm, hm-hm-hm-hm)  (All the love in the world can't be gone All the need to be loved can't be wrong All the records are playing And my heart keeps saying Boogie wonderland, wonderland)  (Dance, boogie wonderland, ah, ah Dance, boogie wonderland, ah, ah)  (I find romance when I start to dance in boogie wonderland I find romance when I start to dance in boogie wonderland)  (Dance, boogie wonderland, ah, ah Dance, boogie wonderland, ah, ah)";Earth, Wind & Fire;Boogie Wonderland;;;;;;;;;;celebratory;Walk around, why wear a frown Say little people, try to put you down  What you need, a helpin' hand All the strength, at your command  How's ya faith? Cause ya faith is you Who you kiddin', to yourself be true Spread ya love, for a brighter day For what ya search, you'll find a way  We are people, of the mighty Mighty people of the sun In our hearts lies all the answers To the truth you can't run from  Eagle flies, every seven days Still cryin the blues, all about ya pay What ya gonna do? Bout your living thang Will ya make it better, or just complain  Everday is real, don't run from fear Cause better days are very near There are times when you are bound to cry One more time, head to the sky  We are people, of the mighty Mighty people of the sun In our hearts lies all the answers To the truth you can't run from;Earth, Wind & Fire;Mighty Mighty;;;;;;;;;;celebratory;Ten years living in a paper bag Feedback baby, he's a flipped out cat He's a platinum canary, drinkin' Falstaff beer Mercedes rule, and a rented Lear Bottom feeder insincere Prophet lo-fi pioneer Sell the house and go to school Get a young girlfriend, daddy's jewel  A change A change would do you good Would do you good A change would do you good I think a change A change would do you good Would do you good A change would do you good  God's little gift is on the rag Poster girl posing in a fashion mag Canine, feline, Jekyll and Hyde Wear your fake fur on the inside Queen of South Beach, aging blues Dinner's at six, wear your cement shoes I thought you were singing your heart out to me Your lips were syncing and now I see  A change A change would do you good Would do you good A change would do you good I think a change A change would do you good Would do you good A change would do you good  A change A change would do you good Would do you good A change would do you good I think a change A change would do you good Would do you good A change would do you good  Chasing dragons with plastic swords Jack off Jimmy, everybody wants more Scully and Angel on the kitchen floor And I'm calling Buddy on the Ouija board I've been thinking 'bout catching a train Leave my phone machine by the Radar Range Hello it's me, I'm not at home If you'd like to reach me, leave me alone  A change A change would do you good Would do you good A change would do you good  Hello it's me, I'm not at home If you'd like to reach me, leave me alone  I think a change A change would do you good Would do you good A change would do you good;Sheryl Crow;A Change Would Do You Good;;;;;;;;;;celebratory;(My my my my my)  Don't you worry 'bout what's on your mind, oh my I'm in no hurry, I can take my time, oh my I'm going red and my tongue's getting tied (tongue's getting tied) I'm off my head and my mouth's getting dry I'm high, but I try, try, try, oh my  Let's spend the night together Now I need you more than ever Let's spend the night together now  I feel so strong that I can't disguise, oh my (Let's spend the night together) But I just can't apologize, oh no (Let's spend the night together) Don't hang me up and don't let me down (don't let me down) We could have fun just groovin' around Around, around, around, oh my  Let's spend the night together Now I need you more than ever Let's spend the night together  Let's spend the night together Now I need you more than ever You know I'm smiling, baby  You need some guiding, baby I'm just deciding, baby, now I need you more than ever Let's spend the night together Let's spend the night together now Oh my my my my my my my  This doesn't happen to me ev'ry day, oh my (Let's spend the night together) No excuses offered anyway, oh my (Let's spend the night together) I'll satisfy your every need (your every need) And now I know you will satisfy me Oh my my my my my my  Let's spend the night together Now I need you more than ever Let's spend the night together Together now, Oh my my my my my my my  (Let's spend the night together) Now I need you, need you more than ever, oh my (Let's spend the night together) I'll satisfy your every need, whoa my my (Let's spend the night together) Now I know, I know you'll satisfy me, whoa my my (Let's spend the night together) I beg you baby, whoa my my my my my my (Let's spend the night together) A-c'mon now, whoa baby my my my (Let's spend the night together);The Rolling Stones;Let's Spend the Night Together;;;;;;;;;;celebratory;Hey! A little less conversation a little more action, All this aggravation ain't satisfactioning me, A little more bite a little less bark, A little less fight and a little more spark, Close your mouth and open up your heart and baby satisfy me, Satisfy me baby.  Baby close your eyes and listen to the music, Dig to the summer breeze, It's a groovy night and I can show you how to use it, Come along with me and put your mind at ease hey.  A little less conversation a little more action please, All this aggravation ain't satisfactioning me, A little more bite a little less bark, A little less fight and a little more spark, Shut your mouth and open up your heart and baby satisfy me, Satisfy me baby.  Come on baby I'm tired of talking. Grab your coat and let's start walking, Come on come on, Come on come on, Come on come on, Don't procrastinate,  Don't articulate, Girl it's getting late, You just sit and wait around.  Yeah, a little less conversation a little more action, All this aggravation ain't satisfactioning me, A little more bite a little less bark, A little less fight and a little more spark, Shut your mouth and open up your heart and baby satisfy me, Satisfy me baby.;Elvis Presley;A Little Less Conversation;;;;;;;;;;celebratory;1 - 2 - 3 - 4   Well, she was just seventeen You know what I mean And the way she looked was way beyond compare So how could I dance with another And I saw her standing there  Well, she looked at me, and I, I could see That before too long, I'd fall in love with her She wouldn't dance with another And I saw her standing there  Well, my heart went boom When I crossed that room And I held her hand in mine  Whoah, we danced through the night And we held each other tight And before too long, I fell in love with her Now, I'll never dance with another Since I saw her standing there  Well, my heart went boom When I crossed that room And I held her hand in mine  Whoah, we danced through the night And we held each other tight And before too long, I fell in love with her Now, I'll never dance with another Since I saw her standing there;Paul McCartney;I Saw Her Standing There;;;;;;;;;;celebratory;1.2.3.4 Heaven loves ya The clouds part for ya Nothing stands in your way When you're a boy  Clothes always fit ya Life is a pop of the cherry When you're a boy  When you're a boy You can wear a uniform When you're a boy Other boys check you out You get a girl These are your favourite things When you're a boy  Boys Boys Boys keep swinging Boys always work it out  Uncage the colours Unfurl the flag Luck just kissed you hello When you're a boy  They'll never clone ya You're always first on the line When you're a boy  When you're a boy You can buy a home of your own When you're a boy Learn to drive and everything You'll get your share When you're a boy  Boys Boys Boys keep swinging Boys always work it out;David Bowie;Boys Keep Swinging;;;;;;;;;;