amiable-good-natured;"You know I can be found Sitting home all alone If you can't come around At least please telephone A-don't be cruel to a heart that's true  Baby, if I made you mad For something I might have said Please, let's forget the past The future looks bright ahead A-don't be cruel to a heart that's true I don't want no other love A-baby, it's still you I'm thinking of, mm  Don't stop thinking of me Don't make me feel this way Come on over here and love me You know what I want you to say A-don't be cruel to a heart that's true Why should we be apart? I really love you, baby, cross my heart  Let's walk up to the preacher And let us say ""I do"" Then you'll know you'll have me And I'll know that I'll have you A-don't be cruel to a heart that's true I don't want no other love A-baby, it's still you I'm thinking of  A-don't be cruel to a heart that's true Don't be cruel to a heart that's true I don't want no other love A-baby, it's still you I'm thinking of";Elvis Presley;Don't Be Cruel;;;;;;;;;;amiable-good-natured;You can shake an apple off an apple tree Shake-a, shake- sugar, but you'll never shake me Uh-uh-uh No-sir-ee, uh, uh I'm gonna stick like glue Stick because I'm stuck on you  I'm gonna run my fingers through your long black hair Squeeze you tighter than a grizzly bear Uh-uh-uh Yes-sir-ee, uh, uh I'm gonna stick like glue Stick because I'm stuck on you  Hide in the kitchen, hide in the hall Ain't gonna do you no good at all 'Cause once I catch ya and the kissin' starts A team o' wild horses couldn't tear us apart  Son to take a tiger from his daddy's side That's how love is gonna keep us tied Uh-uh-uh Uh-uh-uh Oh yeah, uh-uh-uh I'm gonna stick like glue Stick, because I'm stuck on you  Hide in the kitchen, hide in the hall Ain't gonna do you no good at all 'Cause once I catch ya and the kissin' starts A team o' wild horses couldn't tear us apart  Son to take a tiger from his daddy's side That's how love is gonna keep us tied Uh-uh-uh Yes-sir-ee, uh,uh I'm gonna stick like glue Yeah yeah, because I'm stuck on you  I'm gonna stick like glue Yeah yeah, because I'm stuck on you I'm gonna stick like glue Yeah yeah, because I'm stuck on you;Elvis Presley;Stuck on You;;;;;;;;;;amiable-good-natured;You see a pair of laughing eyes, And  suddenly you're sighing sighs You're thinkin' nothin's wrong, You string along, boy, then SNAP!  Those eyes, those sighs  - They're part of the tender trap.  You're hand in hand beneath the trees, And soon there's music in the breeze. You're actin' kind of smug Until your heart just goes WHAP!  Those trees, that breeze - They're part of the tender trap.  Some starry night, When her kisses make you tingle, She'll hold you tight And you'll hate yourself for being single.  And all at once it seems so nice, The folks are throwin' shoes and rice. You hurry to a spot that's just a dot on the map.  You're hooked, you're cooked, You're caught in the tender trap.  Some starry night, When her kisses make you tingle, She'll hold you tight And you'll hate yourself for bein' single.  And all at once it seems so nice, The folks are throwin' shoes and rice. You hurry to a spot that's just a dot on the map  And then you wonder how it all came about, It's too late now, there's no gettin' out - You fell in love, and love is the tender trap.;Frank Sinatra;(Love Is) The Tender Trap;;;;;;;;;;amiable-good-natured;"The wine beneath the bed The things we've done and said And all the mem'ries That come glancing back to me In my loneliness  You're standing in the bridge Beyond that stretch but our love reach An consciousness has found me sometimes wondering Where you're at Umm, take me back again Take me back one more time, Spanish rose  The way ya pulled the gate Behind you when you said, ""It ain't too late Come on, let's swing the town and have a Ball tonight  Yeah, hopin' you'd come through And many others, too And all the friends we used to have in days gone by I'm wondering If you'll take me back again Take me back one more time, Spanish rose  And when the lights went out there No one was about An all the country in full bloom In the room we danced  And many hearts were torn And when the word went 'round That ev'rything was wrong And just couldn't be put right, it Tore me up, it tore me up, Lord  The way you held a note The trembling in your throat That just beginning of your Wondrous smile  The rising of the water The winter winds of days gone by I often ask myself and wonder why It's gone Uhm, take me back again Take me back one more time, Spanish Rose  In slumber you did sleep The window I did creep And touch your raven hair And sang that song Again to you You did not even wince You thought I was the Prince To come and take you from your misery And lonely castle wall  Uhm, take me back again A take me back one more time, Spanish Rose";Van Morrison;Spanish Rose;;;;;;;;;;amiable-good-natured;The boat rides we would take, the moonlight on the lake The way we danced and hummed our fav'rite song The things we did last summer I'll remember all winter long  The midway and the fun, the kewpie dolls we won The bell I rang to prove that I was strong The things we did last summer I'll remember all winter long  The early morning hike, the rented tandem bike The lunches that we used to pack We never could explain that sudden summer rain The looks we got when we got back  The leaves began to fade like promises we made How could a love that seemed so right go wrong? The things we did last summer I'll remember all winter long  brief instrumental  I've tried so to forget, at times I do, and yet The mem'ry of you lingers like our song The things we did last summer, I'll remember all winter long;Frank Sinatra;The Things We Did Last Summer;;;;;;;;;;amiable-good-natured;The song a robin sings, Through years of endless springs, The murmur of a brook at evening tides. That ripples through a nook where two lovers hide.  That great symphonic theme, That's Stella by starlight, And not a dream, My heart and I agree, She's everything on this earth to me.  That great symphonic theme, That's Stella by starlight, And not a dream, My heart and i agree, She's everything on this earth to me.;Frank Sinatra;Stella by Starlight;;;;;;;;;;amiable-good-natured;(Dolly Parton)  I am a seeker A poor sinful creature There is no weaker than I am I am a seeker  You are a teacher You are a reacher So reach down Won't you reach out and lead me Guide me and keep me In the shelter of your care each day 'Cause I am a seeker You are a keeper You are the leader Won't you show me the way  I am a vessel that's empty and useless I am a bad seed that fell by the way I am a loser that wants to be a winner And you are my last hope Don't turn me away  I am a seeker A poor sinful creature There is no weaker than I am I am a seeker You are a teacher You are a reacher So reach down Won't you reach out and lead me Guide me and keep me, Lord In the shelter of your care each day 'Cause I am a seeker You are a keeper You are the leader Won't you show me the way  Oh, I know you are a mountain From which there flows a fountain So let it's water wash my sins away 'Cause I am a seeker You are a keeper You are the leader Won't you show me the way;Dolly Parton;Seeker;;;;;;;;;;amiable-good-natured;All of me Why not take all of me Can't you see That I'm no good without you Take my arms I want to loose them Take my lips I'll never use them  Your goodbye Left me with eyes that cry And I know that I Am no good without you You took the part That once was my heart So why not take all of me  All of me Why not take all of me Can't you see That I'm no good without you Take my arms I want to loose them Take my lips I'll never use them  Your goodbye Left me with eyes that cry And I know that I Am no good without you You took the part That once was my heart So why not take all of me  Why not take all of me;Willie Nelson;All of Me;;;;;;;;;;amiable-good-natured;Blue skies smilin' at me  Nothin' but blue skies do I see  Bluebirds singin' a song  Nothin' but bluebirds all day long   Never saw the sun shinin' so bright  Never saw things goin' so right  Noticing the days hurrying by  When you're in love, my how they fly   Blue days, all of them gone  Nothin' but blue skies from now on  (Blue skies smilin' at me  Nothin' but blue skies do I see)   Never saw the sun shinin' so bright  Never saw things goin' so right  Noticing the days hurrying by  When you're in love, my how they fly   Blue days, all of them gone  Nothin' but blue skies from now on  Nothin' but blue skies from now on;Willie Nelson;Blue Skies;;;;;;;;;;amiable-good-natured;Ridin' on the City of New Orleans Illinois Central Monday morning rail Fifteen cars and fifteen restless riders Three conductors and twenty-five sacks of mail All along the southbound odyssey the train pulls out of Kankakee And rolls along past houses farms and fields Passing trains that have no name and graveyards full of old black men And graveyards full of rusted automobiles  Good morning America how are you?  Say, don't you know me I'm your native son I'm the train they call the City of New Orleans And I'll be gone five hundred miles when the day is done  Dealin' cards with an old man in the club car Penny a point, ain't no one keepin' score Pass that paper bag that holds the bottle And feel the wheels a rumbling neath the floor And the sons of poor men porters and the sons of engineers Ride their father's magic carpet made of steel Mothers with their babes asleep rockin' to that gentle beat And the rhythm of the rails is all they feel  Good morning America how are you?  Say, don't you know me I'm your native son I'm the train they call the City of New Orleans And I'll be gone five hundred miles when the day is done  Night time on the City of New Orleans changing cars in Memphis Tennessee Half way home we'll be there by morning Through the Mississippi darkness rolling down to the sea And all the towns and people seem to fade into a bad dream And the steel rails still ain't heard the news The conductor sings his songs again the passengers will please refrain This train has got the disappearing railroad blues  Good morning America how are you?  Say, don't you know me I'm your native son I'm the train they call the City of New Orleans And I'll be gone five hundred miles when the day is done;Willie Nelson;City of New Orleans;;;;;;;;;;amiable-good-natured;"Pretty paper, pretty ribbons of blue  Wrap your presents to your darling from you  Pretty pencils to write ""I love you"" Pretty paper, pretty ribbons of blue   Crowded street, busy feet hustle by him  Downtown shoppers, Christmas is nigh  There he sits all alone on the sidewalk  Hoping that you won't pass him by   Should you stop?, better not, much too busy  You're in a hurry, my how time does fly  In the distance the ringing of laughter  And in the midst of the laughter he cries   Pretty paper, pretty ribbons of blue  Wrap your presents to your darling from you  Pretty pencils to write ""I love you"" Pretty paper, pretty ribbons of blue";Willie Nelson;Pretty Paper;;;;;;;;;;amiable-good-natured;Silent night, holy night, All is calm, all is bright Round yon virgin mother and child, Holy infant so tender and mild, Sleep in heavenly peace, Sleep in heavenly peace.  Choir: Silent night, holy night All is calm, all is bright  Frank: Round young virgin mother and child Holy infant so tender and mild Sleep in heavenly peace Sleep in heavenly peace     (Below is the version that appears on Seasons Greetings (2007), which is different from the above version, so this artist has at least two versions of the song out):  Silent night, holy night, All is calm, all is bright Round yon virgin mother and child, Holy infant so tender and mild, Sleep in heavenly peace, Sleep in heavenly peace.  Silent night, holy night, Shepherds quake at the sight, Glories stream from heaven afar, Heavenly hosts sing Alleluia; Christ the Savior is born! Christ the Savior is born!;Frank Sinatra;Silent Night;;;;;;;;;amiable-good-natured;"Let's take it nice and easy It's gonna be so easy For us to fall in love  Hey baby what's your hurry Relax and don't you worry We're gonna fall in love  We're on the road to romance - that's safe to say But let's make all the stops along the way  The problem now of course is  To simply hold your horses To rush would be a crime 'Cause nice and easy does it  Nice 'n' easy does it Nice 'n' easy does it every time   ""Like the man says, 'one more time' ""  Nice 'n' easy does it Nice 'n' easy does it Nice 'n' easy does it every time";Frank Sinatra;Nice 'n' Easy;;;;;;;;;;amiable-good-natured;(Now and then there's a fool such as I) Pardon me, if I'm sentimental When we say goodbye Don't be angry with me should I cry When you're gone, yet I'll dream A little dream as years go by Now and then there's a fool such as I   Now and then there's a fool such as I am over you You taught me how to love And now you say that we are through I'm a fool, but I'll love you dear Until the day I die Now and then there's a fool such as I   Now and then there's a fool such as I am over you You taught me how to love And now you say that we are through I'm a fool, but I'll love you dear Until the day I die Now and then there's a fool such as I  Now and then there's a fool such as I Now and then there's a fool such as I;Elvis Presley;(Now and Then There's) A Fool Such as I;;;;;;;;;;amiable-good-natured;London by night is a wonderful sight There is magic abroad in the air I'm often told that the streets turn into gold When the moon shines on * Circus and Square *  Deep in the dark that envelops the park There's romance in each cigarette glow Down by the Thames, lights that sparkle like gems Seem to wink at each girl and her beau  Up comes the moon when the city's asleep He's not alone, for it seems Somewhere up there stands an angel to keep her watch While each Londoner dreams  My love and I saw the sun leave the sky Then we kissed in the fast-fading light Most people say they love London by day But lovers love London by night;Frank Sinatra;London by Night;;;;;;;;;;amiable-good-natured;"Writer(s): Dennis/Adair    Let's take a boat to Bermuda Let's take a plane to Saint Paul. Let's take a kayak to Quincy or Nyack, Let's get away from it all.  Let's take a trip in a trailer No need to come back at all. Let's take a powder to Boston for chowder, Let's get away from it all.  We'll travel 'round from town to town, We'll visit ev'ry state. I'll repeat, ""I love you sweet!"" In all the forty-eight.  Let's go again to Niag'ra This time we'll look at the Fall. Let's leave our hut, dear, Get out of our rut, dear, Let's get away from it all.";Frank Sinatra;Let's Get Away from It All;;;;;;;;;;amiable-good-natured;"Mmm num ba dah Dum bum ba beh Doo buh dum ba beh beh  Pressure Pushing down on me Pressing down on you No man ask for Under pressure That burns a building down Splits a family in two Puts people on streets  Mmm ba ba beh Mmm ba ba beh Bee de dah Ee deh da, that's okay  It's the terror of knowing What this world is about Watching some good friends Screaming ""let me out"" Pray tomorrow Gets me higher Pressure on people People on streets  Deh deh dep Mmm, mmm Dah dah dah bah buh Okay  (Ooh) Chipping around Kick my brains 'round the floor These are the days It never rains, but it pours  Ee do ah buh Ee dah buh bah bop Mmm do bop Beh la  People on streets Dee dah dee dah deh People on streets Dee dah dee dah dee dah dee dah  It's the terror of knowing What this world is about Watching some good friends Screaming ""let me out"" Pray tomorrow gets me higher, higher, high Pressure on people People on streets  Turned away from it all like a blind man Sat on a fence, but it don't work Keep coming up with love, but it's so slashed and torn Why? Why? Why? (Love)  Insanity laughs under pressure we're cracking Can't we give ourselves one more chance? Why can't we give love that one more chance? Why can't we give love, give love, give love, give love Give love, give love, give love, give love?  'Cause love's such an old fashioned Word and love dares you to care for The people on the edge (People on streets) of the night And love dares you to change our way of Caring about ourselves This is our last dance This is our last dance This is ourselves Under pressure Under pressure Pressure";Queen;Under Pressure;;;;;;;;;;amiable-good-natured;Grab your coat and get your hat, leave your worry at the doorstep Just direct your feet to the sunny side of the street Can't you hear that pitter pat and that happy tune is your step Life can be so sweet on the sunny side of the street  I used to walk in the shade with those blues on parade But I'm not afraid 'cause this rover, crossed over  If I never had a cent I'll be as rich as Rockfeller Gold dust at my feet on the sunny side of the street  With those blues on parade Because this rover, it crossed over  If I never had a cent I'll be as loaded as old Rockfeller With that gold dust 'round my feet On the sunny side of the street On the side, at that side of the street that is sunny;Frank Sinatra;On the Sunny Side of the Street;;;;;;;;;;amiable-good-natured;Writer(s): Lerner/Loewe    What a day this has been What a rare mood I'm in Why it's almost like being in love  There's a smile on my face For the whole human race Why it's almost like being in love  All the music of life seems to be (Just) Like a bell that is ringing for me  And from the way that I feel When the bell starts to peel I would swear I was falling, I could swear I was falling - It's almost like being in love;Frank Sinatra;Almost Like Being in Love;;;;;;;;;;amiable-good-natured;Day by Day Im falling more in love with you And day by day My love seems to grow There isn't any end to my devotion It's deeper, dear, by far Than any ocean I find that day by day You're making all my dreams come true So come what may I want you to know I'm yours alone And I'm in love to this day As we go through the years Day by day  Im yours alone And Im in love to this day As we go through the years  Day by Day;Frank Sinatra;Day by Day;;;;;;;;;;amiable-good-natured;What a girl wants, what a girl needs What a girl wants, what a girl needs Yeah, come on Oh, yeah  I wanna thank you for giving me time to breathe Like a rock you waited so patiently While I got it together Hmm, while I figured it out, yeah  I only looked but I never touched 'Cause in my heart was a picture of us Holding hands, making plans And it's lucky for me, you understand  What a girl wants, what a girl needs Whatever makes me happy sets you free And I'm thanking you for knowing exactly  What a girl wants, what a girl needs Whatever keeps me in your arms And I'm thanking you for givin' it to me  What I want is what you got And what you got is what I want  There was a time I was blind I was so confused (Yeah, yeah) Ran away just to hide it all from you But, baby, you knew me better Than I knew myself  They say if you love something let it go (Let it go) If it comes back it's yours, that's how you know It's for keeps, yeah, it's for sure And you're ready and willing to give me more than  What a girl wants, what a girl needs Whatever makes me happy sets you free And I'm thanking you for knowing exactly  What a girl wants, what a girl needs Whatever keeps me in your arms And I'm thanking you for giving it to me, yeah  (What a girl wants, what a girl needs) Somebody sensitive, crazy sexy cool like you, yeah (What a girl wants, what a girl needs) Yes, you got it, it's what I want (Oh yeah!)  (What a girl wants, what a girl needs) It's alright, it's alright You let a girl know how much you care about her I swear you're the one who always knew Oh, you knew, you knew, you knew  Oooh, ohoho, I'm thanking you for being here for me  (What a girl wants, what a girl needs Whatever keeps me in your arms) Whatever keeps me in your arms is what I need, ohohoho  (What a girl wants, what a girl needs Whatever makes me happy sets you free) Oh, it's what I need (And I'm thanking you) Oh, it's what I want (For knowing exactly), it's what I need  What a girl wants, you got it (Whatever keeps me) My baby, I need you (In your arms) 'Cause you know (And I'm thanking you for giving it)  (What a girl wants, what a girl needs) What I want is what you got What you got (Whatever makes me happy sets you free) is what I need (And I'm thanking you for giving it to me) (Ohoho)  Oh, baby (Girl wants), oh darling (Girl needs) Thank you, thank you for giving me what I want And what I need (Girl wants, girl needs), ohohoho, yeah, yeah!  I turn around, babe, whenever you're not there Hahaha, oh yeaheah, yeah;Christina Aguilera;What a Girl Wants;;;;;;;;;;amiable-good-natured;East of the Sun and West of the Moon, We'll build a dream house so lovely Near to the sun in a day, near to the moon at night, We'll live in a lovely way dear Living our love in memory Just you and I, forever and a day,  Love will not die, we'll keep it that way, Up among the stars we'll find A harmony of life, too lovely tune East of the Sun and West of the Moon, dear, East of the Sun and West of the Moon.  Just you and I, forever and a day, Love will not die, we will keep it that way, Way, up among the stars we'll find, East of the Sun and West of the Moon, dear, East of the Sun and West of the Moon.  Up among the stars we'll find A harmony of life, too lovely tune East of the Sun and West of the Moon, dear, East of the Sun and West of the Moon.  Well, Up among the stars we'll find A harmony of life, too lovely tune East of the Sun and West of the Moon, dear, East of the Sun and West of the Moon.;Frank Sinatra;East of the Sun (And West of the Moon);;;;;;;;;;amiable-good-natured;Writer(s): Stanley Adams, Abel Baer, George W Meyer    A heart thats true, there are such things A dream for two, there are such things Someone to whisper Darling youre my guiding star Not caring what you own but just what you are  A peaceful sky, there are such things A rainbow high where heaven sings So have a little faith and trust in what tomorrow brings Youll reach a star because there are such things    So have a little faith and trust in what tomorrow brings Youll reach a star because there are such things;Frank Sinatra;There Are Such Things;;;;;;;;;;amiable-good-natured;Writer(s): Van Heusen/Burke    Imagination is funny  It makes a cloudy day sunny It makes a bee think of honey Just as I think of you  Imagination is crazy Your whole perspective gets hazy Starts you asking a daisy What to do, what to do  Have you ever felt a gentle touch And then a kiss, and then and then Find it's only your imagination again  Imagination is silly You go around willy nilly For example I go around wanting you And yet I can't imagine that you want me too;Frank Sinatra;Imagination;;;;;;;;;;amiable-good-natured;Come fly with me, let's fly, let's fly away If you can use some exotic booze there's a bar in far Bombay Come fly with me, let's fly, let's fly away  Come fly with me, let's float down to Peru In llama-land there's a one man band and he'll toot his flute for you Come fly with me, let's take off in the blue  Once I get you up there, where the air is rarefied We'll just glide, starry eyed Once I get you up there, I'll be holding you so near You may hear, the angels cheer because we're together  Weather-wise it's such a lovely day Just say the words and we'll beat those birds down to Acapulco Bay It's perfect, for a flying honeymoon they say So come fly with me, let's fly, let's fly away  Once I get you up there, where the air is rarefied We'll just glide, starry eyed Once I get you up there, I'll be holding you so near You may hear, all the angels cheer because we're together  Weather-wise it's such a lovely day You just say those words, and we'll beat those birds down to Acapulco Bay It's so perfect for a flying honeymoon they say Come fly with me, let's fly, let's fly   Pack up! let's fly away;Frank Sinatra;Come Fly With Me;;;;;;;;;;amiable-good-natured;Chicago, Chicago that toddling town Chicago, Chicago I will show you around - I love it Bet your bottom dollar you lose the blues in Chicago, Chicago The town that Billy Sunday couldn't shut down  On State Street, that great street, I just want to say They do things they don't do on Broadway They have the time, the time of their life I saw a man, he danced with his wife In Chicago, Chicago my home town  Chicago, Chicago that toddlin' town Chicago, Chicago I'll show you around - I love it Bet your bottom dollar you lose the blues in Chicago, Chicago The town that Billy Sunday could not shut down  On State Street, that great street, I just want to say They do things that they never do on Broadway -- say They have the time, the time of their life I saw a man and he danced with his wife In Chicago, Chicago, Chicago -- that's my home town;Frank Sinatra;Chicago;;;;;;;;;;amiable-good-natured;"You're just too marvelous Too marvelous for words Like ""glorious"", ""glamorous""  And that old standby ""amorous"" It's all too wonderful I'll never find the words That say enough, tell enough I mean they just aren't swell enough  You're much too much And just too very very Too ever be in Webster's dictionary And so I'm borrowing A lovesong from the birds To tell you that you're marvelous Too marvelous for words  You're much, you're too much And just too ""very, very"" To ever be, to ever be In Webster's dictionary And so I'm borrowing A love-song from the birds To tell you that you're marvelous To tell you that you're marvelous To tell you that you're marvelous Too marvelous for words";Frank Sinatra;Too Marvelous for Words;;;;;;;;;;