fun;It was a night oo-oo what a night It was it really was such a night The moon was bright oh how so bright It was it really was such a night The night was alight with stars above Oo-oo when she kissed me I had to fall in love  Oh it was a kiss oo-oo what a kiss It was it really was such a kiss Oh how she could kiss oh what a kiss It was it really was such a kiss Just the thought of her lips Sets me afire I reminisce and I'm filled with desire But I'd gave my heart to her in sweet surrender How well I remember, I'll always remember  Oh, what a night oo-oo what a night It was it really was such a night Came the dawn and my heart and her love And the night was gone But I'll never forget the kiss The kiss in the moonlight Oo-oo such a kiss, such a night  It was a night oo-oo what a night It was it really was such a night Came the dawn and my heart and her love And the night was gone But I'll never forget the kiss The kiss in the moonlight How well I remember, I'll always remember  That night oo-oo what a night It was it really was such a night When we kissed I had to fall in love But I'd gave my heart to her in sweet surrender How well I remember, I'll always remember  Oh that night oo-oo what a night It was it really was such a night When we kissed I had to fall in love Well she's gone, gone, gone Yes she's gone, gone, gone Came the dawn, dawn, dawn And my love was gone But before that dawn Yes before that dawn and before that dawn Oo-oo, oo-oo, oo-oo, oo-oo, oo-oo Such a night;Elvis Presley;Such a Night;;;;;;;;;;fun;You don't like crazy music. You don't like rockin' bands. You just wanna go to a movie show, And sit there holdin' hands. You're so square. Baby, I don't care.  You don't like hotrod racin' Or drivin' late at night. You just wanna park where it's nice and dark. You just wanna hold me tight. You're so square. Baby, I don't care.  You don't know any dance steps that are new, But no one else could love me like you do, do, do, do.  I don't know why my heart flips. I only know it does. I wonder why I love you, baby. I guess it's just because You're so square. Baby, I don't care.;Elvis Presley;(You're So Square) Baby I Don't Care;;;;;;;;;;fun;I've been traveling over mountains, Even through the valleys too. I've been traveling night and day, I've been running all the way, Baby, trying to get to you.  Ever since I read your letter, Where you said you loved me true, I've been traveling night and day, I've been running all the way, Baby, trying to get to you.  When I read your loving letter, Then my heart began to sing. There were many miles between us, But they didn't mean a thing.  I just had to reach you, baby, In spite of all that I've been through. I kept traveling night and day, I kept running all the way, Baby, trying to get to you.  Well if I had to do it over, That's exactly what I'd do. I would travel night and day, And I'd still run all the way, Baby, trying to get to you.  Well, there's nothing that could hold me, Or that could keep me away from you. When your loving letter told me, That you really loved me true.  Lord above me knows I love you. It was He who brought me through. When my way was dark as night, He would shine His brightest light, When I was trying to get to you.;Elvis Presley;Trying to Get to You;;;;;;;;;;fun;Well, I got a woman way cross town She's a-good to me, oh-oh yeah Say, I got a woman way cross town She's good to me, oh yeah  She give me money when I'm in need Yeah she's a kind, a kind of friend indeed  I got a woman way cross town She's good to me, oh-oh yeah  She saves her lovin'  Early in the morning just for me oh-oh yeah She saves her lovin early in the morning just for me, oh yeah  She saves her lovin just for me  Yeah you know she love me so tenderly I got a woman way cross town She's a-good to me, oh-oh yeah  She's there to love me both day and night No groans or fusses, just treats me right Never running in the streets Leaving me alone She knows a woman's place Right there now in the home  I got a woman way cross town She's a-good to me, oh-oh yeah Say, I got a woman way cross town She's good to me, ooh yeah  Well she's my baby, don't you understand I I I I I'm her loving man I got a woman Way cross town She's a-good to me, oh-oh yeah  And don't you know she's alright She's alright, she's alright  I got a woman Way over town Good to me, yeah yeah;Elvis Presley;I Got a Woman;;;;;;;;;;fun;I'm a steamroller baby I'm 'bout to roll all over you I'm a steamroller baby I'm 'bout to roll all over you I'm gonna inject your soul With sweet rock'n'roll, poor heaven  I'm a cement mixer A churning urn of burning funk I'm a cement mixer A churning urn of burning funk I'm a demolition derby A hefty hunk of steaming junk, play it baby  I'm a steamroller baby I'm 'bout to roll over you I'm a steamroller baby I'm 'bout to roll over you I'm gonna inject your soul With some sweet rock'n'roll And shoot you full of rhythm and blues  I'm a napalm bomb Guaranteed to blow your mind I'm a napalm bomb Guaranteed to blow your mind If I can't have your love now baby There won't be nothing left behind;Elvis Presley;Steamroller Blues;;;;;;;;;;fun;Ready set go man go I got a gal that I love so  I'm rea-dy rea-dy rea-dy teddy I'm rea-dy rea-dy rea-dy teddy I'm rea-dy rea-dy rea-dy teddy Rea-dy rea-dy rea-dy to Rock 'n' roll  Going down to the corner Pick up my sweetie pie She's my rock 'n' roll baby She's the apple of my eye, 'cause  Flat top cats and the dungaree dolls Are headed for the gym to the sock hop ball The joint is really jumping The cats are going wild The music really sends me I dig that crazy style 'cause  Gonna kick off my shoes Roll up my faded jeans Grab my rock 'n' roll baby Pour on the steam I shuffle to the left I shuffle to the right I'm gonna rock 'n' roll Till the early early night 'cause;Elvis Presley;Ready Teddy;;;;;;;;;;fun;"When you looked into my eyes I stood there like I was hypnotized You sent a feeling to my spine A feeling warm and smooth and fine But all I could do were stand there paralyzed When we kissed, ooh what a thrill You took my hand and, ooh baby, what a chill I felt like grabbin' you real tight Squeeze and squeeze with all my might But all I could do were stand there paralyzed  Oh yeah lucky me, I'm singing ev'ry day Ever since that day you came my way You made my life for me just one big happy game I'm gay ev'ry morning At night I'm still the same Do you remember that wonderful time You held my hand and swore that you'll be mine In front of preacher you said ""I do"" I couldn't say a word for thinking of you All I could do was stand there paralyzed";Elvis Presley;Paralyzed;;;;;;;;;;fun;Gonna tell Aunt Mary about Uncle John He claim he got married but he havin' lots of fun Oh baby, hey baby, whoo-oo baby Havin' me some fun tonight  Well long tall Sally - she's built sweet She got everything - that Uncle John need Oh baby, hey baby, whoo-oo baby Havin' me some fun tonight  Well I saw Uncle John - with bald headed Sally He saw Aunt Mary comin' and he ducked back in the alley Oh baby, hey baby, oo baby Havin' me some fun tonight  Well long tall Sally - she's - built sweet She got everything - that Uncle John need Oh baby, hey baby, whoo-oo baby Havin' me some fun tonight  You know I saw Uncle John - with bald headed Sally He saw Aunt Mary comin' and he ducked back in the alley Oh baby, hey baby, oo baby Havin' me some fun tonight  Go I'm gonna have some fun tonight - have some fun tonight Have some fun tonight - everything's all right Have some fun - have me some fun tonight;Elvis Presley;Long Tall Sally;;;;;;;;;;fun;When my blue moon turns to gold again When my rainbow turns the clouds away When my blue moon turns to gold again You'll be back within my arms to stay  When the memories that linger in our hearts Memories that make my heart cold However some day they'll live again sweetheart And my blue moon again will turn to gold;Elvis Presley;When My Blue Moon Turns to Gold Again;;;;;;;;;;fun;'Cause it's Saturday nite and I just got paid Fool about my money don't try to save My heart says go, go Have a time 'cause it's Saturday nite And I'm feelin' fine  I'm gonna rip it up I'm gonna rock it up I'm gonna shake it up I'm gonna ball it up I'm gonna rip it up And ball tonite  I got a date and I won't be late Pick her up in my '88' Shag it on down to the union hall When the music starts jumpin' I'll have a ball  Along about 10 I'll be flying high Rocking on out into the sky I don't care if I spend my gold 'Cause tonite I'm gonna be one happy soul;Elvis Presley;Rip It Up;;;;;;;;;;fun;Jeepers creepers, where'd you get those peepers? Jeepers creepers, where'd you get those eyes? Gosh, all git up, how'd they get so lit up? Gosh, all git up, how'd they get that size?  Golly gee, when you turn those heaters on Woe is me, I gotta put my cheaters on Jeepers creepers, where'd you get those peepers? Oh, those weepers, how they hypnotize Where did you get those eyes?  Golly gee, when you turn those heaters on Woe is me, gotta put my cheaters on Jeepers creepers, where did you get those peepers? Oh, those weepers, how they hypnotize Where did you get those eyes?;Tony Bennett;Jeepers Creepers;;;;;;;;;;fun;Baby, let me be Your lovin' teddy bear Put a chain around my neck And lead me anywhere  Oh, let me be (oh, let him be) Your teddy bear  I don't wanna be a tiger 'Cause tigers play too rough I don't wanna be a lion 'Cause lions ain't the kind you love enough  I just wanna be Your teddy bear Put a chain around my neck And lead me anywhere  Oh, let me be (oh, let him be) Your teddy bear  Baby, let me be Around you every night Run your fingers through my hair And cuddle me real tight  Oh, let me be (oh, let him be) Your teddy bear  I don't wanna be a tiger 'Cause tigers play too rough I don't wanna be a lion 'Cause lions ain't the kind you love enough  Just wanna be Your teddy bear Put a chain around my neck And lead me anywhere  Oh, let me be (oh, let him be) Your teddy bear Oh, let me be (oh, let him be Your teddy bear) I just wanna be your teddy bear;Elvis Presley;(Let Me Be Your) Teddy Bear;;;;;;;;;;fun;"Writer(s): Dennis/Adair    Let's take a boat to Bermuda Let's take a plane to Saint Paul. Let's take a kayak to Quincy or Nyack, Let's get away from it all.  Let's take a trip in a trailer No need to come back at all. Let's take a powder to Boston for chowder, Let's get away from it all.  We'll travel 'round from town to town, We'll visit ev'ry state. I'll repeat, ""I love you sweet!"" In all the forty-eight.  Let's go again to Niag'ra This time we'll look at the Fall. Let's leave our hut, dear, Get out of our rut, dear, Let's get away from it all.";Frank Sinatra;Let's Get Away from It All;;;;;;;;;;fun;Grab your coat and get your hat, leave your worry at the doorstep Just direct your feet to the sunny side of the street Can't you hear that pitter pat and that happy tune is your step Life can be so sweet on the sunny side of the street  I used to walk in the shade with those blues on parade But I'm not afraid 'cause this rover, crossed over  If I never had a cent I'll be as rich as Rockfeller Gold dust at my feet on the sunny side of the street  With those blues on parade Because this rover, it crossed over  If I never had a cent I'll be as loaded as old Rockfeller With that gold dust 'round my feet On the sunny side of the street On the side, at that side of the street that is sunny;Frank Sinatra;On the Sunny Side of the Street;;;;;;;;;;fun;Writer(s): Lerner/Loewe    What a day this has been What a rare mood I'm in Why it's almost like being in love  There's a smile on my face For the whole human race Why it's almost like being in love  All the music of life seems to be (Just) Like a bell that is ringing for me  And from the way that I feel When the bell starts to peel I would swear I was falling, I could swear I was falling - It's almost like being in love;Frank Sinatra;Almost Like Being in Love;;;;;;;;;;fun;Well, don't you worry 'bout what's been on my mind I'm in no hurry I can take my time I'm going red and my tongue's getting tired Out of my head and my mouth's getting dry I'm h-h-h-high  Let's spend the night together Now I need you more than ever Let's spend the night together, now  I feel so strong that I can't disguise, oh my Well, I just can't apologise, no Don't hang me up but don't let me down We could have fun just by fooling around, and around and around  Let's spend the night together Now I need you more than ever Let's spend the night together, now  Oh You know I'm smiling baby You need some guiding baby I'm just deciding baby  Let's spend the night together Now I need you more than ever Let's spend the night together, now  This doesn't happen to me every day No excuses I've got anyway, hey I'll satisfy your every need And I'll know you'll satisfy me, oh my-my-my my-my  Let's spend the night together Now I need you more than ever Let's spend the night together Now I need you more than ever Let's spend the night together Now I need you more than ever  Let's spend the night together They said we were too young Our kind of love was no fun But our love comes from above Do it! Let's make love Hoo!  Let's spend the night together Now I need you more than ever Let's spend the night together, now;David Bowie;Let's Spend the Night Together;;;;;;;;;;fun;Shakey threw a party that lasted all night Everybody drank a lot of something nice There was an old-fashioned band of married men Looking up to me for encouragement - it was so-so  The ladies looked bad but the music was sad No one took their eyes off Lorraine She shimmered and she strolled like a Chicago moll Her feathers looked better and better - it was so-so  Yeah! It was time to unfreeze When the Reverend Alabaster danced on his knees Slam! So it wasn't it a game Cracking all the mirrors in shame  Watch that man! Oh honey, watch that man! He walks like a jerk but he could eat you with a fork and spoon Watch that man! Oh honey, watch that man! He walks like a jerk but he's only taking care of the room Must be in tune  A Benny Goodman fan painted holes in his hands Shakey hung him up to dry The pundits were joking, the manholes were smoking Every bottle battled with the reason why  The girl on the phone wouldn't leave me alone A throw back from someone's LP A lemon in a bag played a Tiger Rag And the villains on the screen stopped bleeding  Yeah! I was shaking like a leaf For I couldn't understand the conversation Yeah! And I ran to the street, looking for information  Watch that man! Oh honey, watch that man! He talks like a jerk but he could eat you with a fork and spoon Watch that man! Oh honey, watch that man! He walks like a jerk but he's only taking care of the room Must be in tune  Watch that man Watch that man Watch that man Watch that man Watch that man Watch that man Watch that man Watch that man Watch that man Watch that man Watch that man Watch that man;David Bowie;Watch That Man;;;;;;;;;;fun;I'm up on the eleventh floor  And I'm watching the cruisers below  He's down on the street  And he's trying hard to pull sister Flo Oh, my heart's in the basement  My weekend's at an all time low  'Cause she's hoping to score  So I can't see her letting him go   Walk out of her heart  Walk out of her mind  Oh, not her  She's so swishy in her satin and tat  In her frock coat and bipperty-bopperty hat  Oh God, I could do better than that Oh yeah  She's an old-time ambassador of sweet talking, night walking games Oh and she's known in the darkest clubs for pushing ahead of the dames If she says she can do it, then she can do it She don't make false claims  But she's a queen, and such are queens, that your laughter is sucked in their brains   Now she's leading him on  And she'll lay him right down  Yes, she's leading him on  And she'll lay him right down  But it could have been me  Yes, it could have been me  Why didn't I say? Why didn't I say? No, no, no   She's so swishy in her satin and tat  In her frock coat and bipperty-bopperty hat  Oh God, I could do better than that   So I lay down a while and I gaze at my hotel wall Oh the cot is so cold, it don't feel like no bed at all Yeah, I lay down a while and I look at my hotel wall But he's down on the street so I throw both his bags down the hall And I'm phoning a cab 'cause my stomach feels small There's a taste in my mouth and it's no taste at all It could have been me, oh yeah, it could have been me Why didn't I say, why didn't I say No, no, no   She's so swishy in her satin and tat  In her frock coat and bipperty-bopperty hat  Oh God, I could do better than that;David Bowie;Queen Bitch;;;;;;;;;;fun;What a girl wants, what a girl needs What a girl wants, what a girl needs Yeah, come on Oh, yeah  I wanna thank you for giving me time to breathe Like a rock you waited so patiently While I got it together Hmm, while I figured it out, yeah  I only looked but I never touched 'Cause in my heart was a picture of us Holding hands, making plans And it's lucky for me, you understand  What a girl wants, what a girl needs Whatever makes me happy sets you free And I'm thanking you for knowing exactly  What a girl wants, what a girl needs Whatever keeps me in your arms And I'm thanking you for givin' it to me  What I want is what you got And what you got is what I want  There was a time I was blind I was so confused (Yeah, yeah) Ran away just to hide it all from you But, baby, you knew me better Than I knew myself  They say if you love something let it go (Let it go) If it comes back it's yours, that's how you know It's for keeps, yeah, it's for sure And you're ready and willing to give me more than  What a girl wants, what a girl needs Whatever makes me happy sets you free And I'm thanking you for knowing exactly  What a girl wants, what a girl needs Whatever keeps me in your arms And I'm thanking you for giving it to me, yeah  (What a girl wants, what a girl needs) Somebody sensitive, crazy sexy cool like you, yeah (What a girl wants, what a girl needs) Yes, you got it, it's what I want (Oh yeah!)  (What a girl wants, what a girl needs) It's alright, it's alright You let a girl know how much you care about her I swear you're the one who always knew Oh, you knew, you knew, you knew  Oooh, ohoho, I'm thanking you for being here for me  (What a girl wants, what a girl needs Whatever keeps me in your arms) Whatever keeps me in your arms is what I need, ohohoho  (What a girl wants, what a girl needs Whatever makes me happy sets you free) Oh, it's what I need (And I'm thanking you) Oh, it's what I want (For knowing exactly), it's what I need  What a girl wants, you got it (Whatever keeps me) My baby, I need you (In your arms) 'Cause you know (And I'm thanking you for giving it)  (What a girl wants, what a girl needs) What I want is what you got What you got (Whatever makes me happy sets you free) is what I need (And I'm thanking you for giving it to me) (Ohoho)  Oh, baby (Girl wants), oh darling (Girl needs) Thank you, thank you for giving me what I want And what I need (Girl wants, girl needs), ohohoho, yeah, yeah!  I turn around, babe, whenever you're not there Hahaha, oh yeaheah, yeah;Christina Aguilera;What a Girl Wants;;;;;;;;;;fun;I'm gonna tell you how it's gonna be You're gonna give your love to me I'm gonna love you night and day Well love is love and not fade away Well love is love and not fade away  My love bigger than a Cadillac I try to show it and you're drivin' me back Your love for me has got to be real For you to know just how I feel Love is real and not fade away Well love is real and not fade away  I'm gonna tell you how it's gonna be You're gonna give your love to me Love to last more than one day Well love is love and not fade away Well love is love and not fade away Well love is love and not fade away;The Rolling Stones;Not Fade Away;;;;;;;;;;fun;Writer(s): Van Heusen/Burke    Imagination is funny  It makes a cloudy day sunny It makes a bee think of honey Just as I think of you  Imagination is crazy Your whole perspective gets hazy Starts you asking a daisy What to do, what to do  Have you ever felt a gentle touch And then a kiss, and then and then Find it's only your imagination again  Imagination is silly You go around willy nilly For example I go around wanting you And yet I can't imagine that you want me too;Frank Sinatra;Imagination;;;;;;;;;;fun;There's this girl that's been on my mind All the time, Su-Sussudio oh, oh Now she don't even know my name But I think she likes me just the same Su-Sussudio oh, oh  Oh, if she called me I'd be there I'd come running anywhere She's all I need all my life I feel so good if I just say the word Su-Sussudio, just say the word Su-Sussudio  Now I know that I'm too young My life has just begun Su-Sussudio oh, oh Ooh, give me a chance, give me a sign I'll show her anytime Su--su-su-sussudio oh, oh  Ah, I've just got to have her, have her now I've got to get closer but I don't know how She makes me nervous and makes me scared But I feel so good if I just say the word Su-Sussudio, just say the word Su-Sussudio, oh  Ah, she's all I need all of my life I feel so good if I just say the word Su-Sussudio, I just say the word Su-Sussudio,  I just say the word Su-Sussudio,  I'll say the word Su-Sussudio oh, oh oh  Just say the word Ooh, just say the word Just say the word Su-Sussdio Su-Sussdio Su-Sussdio Su-Sussdio Sussdio Su-Sussdio  Just say the word Su-Sussdio Just say the word, oh Just say the word;Phil Collins;Sussudio;;;;;;;;;;gleeful;Hello there The angel from my nightmare The shadow in the background of the morgue The unsuspecting victim Of darkness in the valley We can live like Jack and Sally If we want Where you can always find me And we'll have Halloween on Christmas And in the night we'll wish this never ends We'll wish this never ends  (I miss you) (I miss you)  Where are you? And I'm so sorry I cannot sleep I cannot dream tonight I need somebody and always This sick, strange darkness Comes creeping on so haunting every time And as I stared I counted The webs from all the spiders Catching things and eating their insides Like indecision to call you And hear your voice of treason Will you come home And stop this pain tonight? Stop this pain tonight  Don't waste your time on me You're already the voice inside my head (I miss you, miss you) Don't waste your time on me You're already the voice inside my head (I miss you, miss you)  Don't waste your time on me You're already the voice inside my head (I miss you, miss you) Don't waste your time on me  You're already the voice inside my head (I miss you, miss you)  Don't waste your time on me You're already the voice inside my head  (I miss you, miss you) Don't waste your time on me You're already the voice inside my head (I miss you, miss you)  (I miss you, miss you) (I miss you, miss you) (I miss you, miss you) (I miss you, miss you);blink-182;I Miss You;;;;;;;;;;gleeful;Ahh-ahh-ahh-ahh-ahh  Lovely Rita, meter maid Lovely Rita, meter maid  Lovely Rita, meter maid Nothing can come between us When it gets dark I tow your heart away  Standing by a parking meter When I caught a glimpse of Rita Filling in the ticket in her little white book In a cap she looked much older And the bag across her shoulder Made her look a little like a military man  Lovely Rita, meter maid May I inquire discreetly When are you free to take some tea with me?  Rita  Took her out and tried to win her Had a laugh and over dinner Told her I would really like to see her again Got the bill and Rita paid it Took her home and nearly made it Sitting on a sofa with a sister or two  Oh lovely Rita, meter maid Where would I be without you? Give us a wink and make me think of you  Lovely Rita, meter maid  They'll never believe it;The Beatles;Lovely Rita;;;;;;;;;;gleeful;It won't be long Yeah (yeah) yeah (yeah) yeah (yeah) It won't be long Yeah (yeah) yeah (yeah) yeah (yeah) It won't be long Yeah (yeah) 'Til I belong to you (ahh)  Every night, when everybody has fun Here am I, sitting all on my own  It won't be long Yeah (yeah) yeah (yeah) yeah (yeah) It won't be long Yeah (yeah) yeah (yeah) yeah (yeah) It won't be long Yeah (yeah) 'Til I belong to you (ahh)  Since you left me (you left me here on my own) I'm so alone Now you're coming You're coming on home (now you're coming on home) I'll be good like I know I should (yes, you should be) You're coming home (aaah) You're coming home  Every night, the tears come down from my eye Every day, I've done nothing but cry  It won't be long Yeah (yeah) yeah (yeah) yeah (yeah) It won't be long Yeah (yeah) yeah (yeah) yeah (yeah) It won't be long Yeah (yeah) 'Til I belong to you (ahh)  Since you left me (you left me here on my own) I'm so alone Now you're coming You're coming on home (now you're coming on home) I'll be good like I know I should (yes, you should be) You're coming home (aaah) You're coming home  So every day, we'll be happy, I know Now I know that you won't leave me no more  It won't be long Yeah (yeah) yeah (yeah) yeah (yeah) It won't be long (Yeah) yeah (yeah) yeah (yeah) It won't be long Yeah (yeah) 'Til I belong to you;The Beatles;It Won't Be Long;;;;;;;;;;